date,item_name,price,price_per_unit,sale_price,store
2024-11-21,N/A,N/A,N/A,N/A,Walmart
2024-11-21,N/A,N/A,N/A,N/A,Walmart
2024-11-21,N/A,N/A,N/A,N/A,Walmart
2024-11-21,N/A,N/A,N/A,N/A,Walmart
2024-11-21,"Great Value Crispy Rice Treats, 40 Count",9.48,30.4 ¢/oz,N/A,Walmart
2024-11-21,"Great Value Sodium Free Seltzer Water, 33.8 fl oz",0.97,2.9 ¢/fl oz,N/A,Walmart
2024-11-21,"Great Value Shredded Mild Cheddar Cheese, 8 oz Bag (Plastic Packaging)",2.24,28.0 ¢/oz,N/A,Walmart
2024-11-21,"Great Value Original Strawberry Lowfat Yogurt, 6 oz, 4 Count",2.34,9.8 ¢/oz,N/A,Walmart
2024-11-21,"Great Value Pizza Crust Mix, 6.5 oz",0.78,12.0 ¢/oz,N/A,Walmart
2024-11-21,"Great Value No Salt Added Tomato Sauce, 8 oz",0.48,6.0 ¢/oz,N/A,Walmart
2024-11-21,"Great Value Mild Cheddar Cheese, 8 oz Block (Plastic Packaging)",2.24,28.0 ¢/oz,N/A,Walmart
2024-11-21,"Great Value Organic Chicken Broth, 32 oz Carton, Shelf-Stable/Ambient, Liquid",1.96,6.1 ¢/oz,N/A,Walmart
2024-11-21,"Great Value Fruit & Grain Cereal Bars, Variety Pack, 1.3 oz, 32 Count",7.44,17.9 ¢/oz,N/A,Walmart
2024-11-21,"Great Value Frosted Cookies & Cream Toaster Pastries, 20.3oz, 12 Count",1.97,9.7 ¢/oz,N/A,Walmart
2024-11-21,"Great Value Frozen Tilapia Skinless & Boneless Fillets, 2 lb",9.76,30.5 ¢/oz,N/A,Walmart
2024-11-21,"Great Value Fully Cooked Italian Style Meatballs, 32 oz (Frozen)",7.47,23.3 ¢/oz,N/A,Walmart
2024-11-21,Great Value Small Shells 16 oz,0.98,6.1 ¢/oz,N/A,Walmart
2024-11-21,"Great Value Vanilla Ice Cream, 1 Gal",7.12,5.6 ¢/fl oz,N/A,Walmart
2024-11-21,"Great Value Crinkle Cut French Fried Potatoes, 80 oz Bag (Frozen)",7.16,9.0 ¢/oz,N/A,Walmart
2024-11-21,"Great Value White Meat Chicken Egg Rolls, 10.8 oz, 4 Count (Frozen)",2.98,27.6 ¢/oz,N/A,Walmart
2024-11-21,"Great Value Mild Taco Seasoning Mix, 1 oz",0.47,47.0 ¢/oz,N/A,Walmart
2024-11-21,"Great Value Block Gouda Cheese, 8 oz",2.24,28.0 ¢/oz,N/A,Walmart
2024-11-21,"Great Value Mint Chip Ice Cream, 48 fl oz",2.87,6.0 ¢/fl oz,N/A,Walmart
2024-11-21,"Great Value Unsweetened Applesauce, 46 oz Jar",3.12,6.8 ¢/oz,N/A,Walmart
2024-11-21,"Great Value Whipped Cream Cheese Spread, 8oz Tub",2.27,28.4 ¢/oz,N/A,Walmart
2024-11-21,"Great Value 100% Pure Beef Burgers, 85% Lean/15% Fat, 3 lbs, 12 Count (Frozen)",13.97,29.1 ¢/oz,N/A,Walmart
2024-11-21,"Great Value Butternut Squash, 10 oz (Frozen)",1.92,19.2 ¢/oz,N/A,Walmart
2024-11-21,"Great Value Small Fajita Flour Tortillas, 22.5 oz, 20 Count",2.12,9.4 ¢/oz,N/A,Walmart
2024-11-21,"Great Value Fajita Seasoning Mix, 1.25 oz",0.62,47.7 ¢/oz,N/A,Walmart
2024-11-21,"Great Value Peanut Butter Sandwich Cookies, 16 oz, Shelf-Stable/Ambient, Whole, 36 Count",3.12,19.5 ¢/oz,N/A,Walmart
2024-11-21,"Great Value Seasoned French Fried Potatoes, 64 oz Bag (Frozen)",5.87,9.2 ¢/oz,N/A,Walmart
2024-11-21,"Great Value Lemon 100% Juice, 32 fl oz",2.88,9.0 ¢/fl oz,N/A,Walmart
2024-11-21,"Great Value Microwavable Sausage & Pepperoni Combination Pizza, 7.2 oz (Frozen)",1.17,16.3 ¢/oz,N/A,Walmart
2024-11-21,"Great Value Chive & Onion Cream Cheese Spread, 8 oz Tub",2.27,28.4 ¢/oz,N/A,Walmart
2024-11-21,"Great Value Organic 2% Reduced Fat Milk, Half Gallon, 64 fl oz",3.98,6.2 ¢/fl oz,N/A,Walmart
2024-11-21,"Great Value 0% Milkfat Small Curd Fat Free Cottage Cheese, 24 oz",2.94,12.3 ¢/oz,N/A,Walmart
2024-11-21,Great Value Uncooked Maple Breakfast Pork Sausage Links 12 oz Package,3.48,$4.64/lb,N/A,Walmart
2024-11-21,"Great Value Red Enchilada Sauce, 10 oz",1.00,10.0 ¢/oz,N/A,Walmart
2024-11-21,"Great Value Original Snack Meat Sticks, 3.92 oz, 14 Count",3.13,$13.04/lb,N/A,Walmart
2024-11-21,"Great Value Original English Muffins, 12 oz Bag, 6 Count (Refrigerated)",1.48,12.3 ¢/oz,N/A,Walmart
2024-11-21,"Great Value Neapolitan Ice Cream Sandwiches, 42 oz, 12 Pack",2.88,6.9 ¢/fl oz,N/A,Walmart
2024-11-21,"Great Value Fudge Ice Cream Bars, 30 fl oz 12 Pack",2.68,8.9 ¢/fl oz,N/A,Walmart
2024-11-21,"Great Value: 100% Extra Virgin Olive Oil, 25.5 fl oz",10.88,42.7 ¢/fl oz,N/A,Walmart
2024-11-21,"Great Value Gluten-Free French Onion Dip, 16 oz Tub",1.97,12.3 ¢/oz,N/A,Walmart
2024-11-21,N/A,N/A,N/A,N/A,Walmart
2024-11-21,"Great Value Sardines in Water, 3.75 oz",0.98,25.8 ¢/oz,N/A,Walmart
2024-11-21,N/A,N/A,N/A,N/A,Walmart
2024-11-21,N/A,N/A,N/A,N/A,Walmart
2024-11-21,N/A,N/A,N/A,N/A,Walmart
2024-11-21,N/A,N/A,N/A,N/A,Walmart
2024-11-21,"Great Value Crispy Rice Treats, 40 Count",9.48,30.4 ¢/oz,N/A,Walmart
2024-11-21,"Great Value: 100% Extra Virgin Olive Oil, 25.5 fl oz",10.88,42.7 ¢/fl oz,N/A,Walmart
2024-11-21,"Great Value Queso Blanco Cheese Dip, 15 oz",2.47,16.5 ¢/oz,N/A,Walmart
2024-11-21,"Great Value Lemon Juice, 15 fl oz",1.78,11.9 ¢/fl oz,N/A,Walmart
2024-11-21,"Great Value Lime 100% Juice, 15 fl oz",1.24,8.3 ¢/fl oz,N/A,Walmart
2024-11-21,"Great Value Fudge-Covered Peanut Butter-Filled Cookies, 9.5 oz",2.12,22.3 ¢/oz,N/A,Walmart
2024-11-21,"Great Value 100% Pure Canned Pumpkin, 29 oz Can",2.74,9.4 ¢/oz,N/A,Walmart
2024-11-21,"Great Value Plain Salt, 26 oz",0.67,2.6 ¢/oz,N/A,Walmart
2024-11-21,"Great Value Block Medium Cheddar Cheese, 8 oz (Plastic Packaging)",2.24,28.0 ¢/oz,N/A,Walmart
2024-11-21,"Great Value Fat-Free Turkey Breast, 16 oz Bag",3.97,$3.97/lb,N/A,Walmart
2024-11-21,"Great Value Navy Bean, 15.5 oz Can",0.86,5.5 ¢/oz,N/A,Walmart
2024-11-21,"Great Value Deli Style Sliced Swiss Cheese, 16 oz, 24 Count",4.22,26.4 ¢/oz,N/A,Walmart
2024-11-21,"Great Value Sugar-Free Strawberry Watermelon Powdered Drink Mix, 0.11 oz, 10 Packets",2.24,$2.24,1.98,Walmart
2024-11-21,"Great Value Asparagus Spears, 8 oz (Frozen)",2.97,37.1 ¢/oz,N/A,Walmart
2024-11-21,"Great Value Organic Chick Pea Garbanzo Beans, 15 oz Can",1.16,7.7 ¢/oz,N/A,Walmart
2024-11-21,"Great Value Melt'n Dip Easy Melt Cheese, 32 oz",5.28,16.5 ¢/oz,N/A,Walmart
2024-11-21,"Great Value Shredded Extra Sharp Cheddar Cheese, 16 oz",4.22,26.4 ¢/oz,N/A,Walmart
2024-11-21,"Great Value Organic Vegetable Broth, 32 oz Carton, Shelf-Stable/Ambient, Gluten-Free, Liquid",1.96,6.1 ¢/oz,N/A,Walmart
2024-11-21,"Great Value Thick Sliced Texas Toast, 20 oz",1.98,9.9 ¢/oz,N/A,Walmart
2024-11-21,"Great Value Sliced Beets, Gluten-Free, 15 oz Can",0.78,5.2 ¢/oz,N/A,Walmart
2024-11-21,"Great Value Chocolate Chip Chewy Granola Bars, Value Pack, 0.84 oz, 24 Count",3.84,18.9 ¢/oz,N/A,Walmart
2024-11-21,"Great Value Sausage Breakfast Bowl, 7 oz (Frozen)",2.43,$2.43,2.00,Walmart
2024-11-21,"Great Value Heavy Whipping Cream, 64 fl oz",9.48,14.8 ¢/fl oz,N/A,Walmart
2024-11-21,"Great Value Grated Parmesan and Romano Cheese, 8 oz Bottle",2.98,37.3 ¢/oz,N/A,Walmart
2024-11-21,"Great Value Mango Chunks, Frozen, 16 oz",3.26,20.4 ¢/oz,N/A,Walmart
2024-11-21,"Great Value Tomato Paste, 12 oz",1.22,10.2 ¢/oz,N/A,Walmart
2024-11-21,"Great Value Finely Shredded Mild Cheddar Cheese, 16 oz",4.22,26.4 ¢/oz,N/A,Walmart
2024-11-21,"Great Value Frozen Wild Caught Pink Salmon Skin-on Fillets, 2 lb",13.98,$13.98,10.48,Walmart
2024-11-21,"Great Value Donut Shop 100% Arabica Medium Roast Ground Coffee Pods, 48 Ct",16.47,89.5 ¢/oz,N/A,Walmart
2024-11-21,Great Value Gv Chocolate Syrup 24oz,2.54,10.6 ¢/oz,N/A,Walmart
2024-11-21,"Great Value Raw Jumbo Tail-off Shrimp, 16 oz (21-30 Count per lb) (Frozen)",7.92,49.5 ¢/oz,N/A,Walmart
2024-11-21,"Great Value Family Size Minced Garlic in Water, 32 oz Jar",5.42,16.9 ¢/oz,N/A,Walmart
2024-11-21,"Great Value Monterey Jack Cheese, 16 oz Block (Plastic Packaging)",4.22,26.4 ¢/oz,N/A,Walmart
2024-11-21,Great Value Deluxe Moist Yellow Cake Mix 15.25 oz Box,1.12,7.3 ¢/oz,N/A,Walmart
2024-11-21,"Great Value Frozen Cooked Extra Large Peeled & Deveined, Tail-on Shrimp, 12 oz (26-30 Count per lb)",6.46,53.8 ¢/oz,N/A,Walmart
2024-11-21,"Great Value Three Cheese Shells and Cheese, 7.25 oz Shelf Stable Packaged Meal",0.58,7.9 ¢/oz,N/A,Walmart
2024-11-21,"Great Value Original Applesauce, 4 oz, 6 Count",2.24,9.3 ¢/oz,N/A,Walmart
2024-11-21,"Great Value Dark Chocolate Baking Chips, 10 oz Bag",2.97,29.7 ¢/oz,N/A,Walmart
2024-11-21,"Great Value Light Greek Strawberry Nonfat Yogurt, 5.3 oz, 4 Count",2.47,11.7 ¢/oz,N/A,Walmart
2024-11-21,"Great Value Mandarin Oranges in Light Syrup, 29 oz",2.56,8.8 ¢/oz,N/A,Walmart
2024-11-21,N/A,N/A,N/A,N/A,Walmart
2024-11-21,"Great Value Family Size Reduced Sodium Chicken Broth, 48 oz Carton, Shelf-Stable/Ambient, Gluten-Free, Liquid",1.98,4.1 ¢/oz,N/A,Walmart
2024-11-21,N/A,N/A,N/A,N/A,Walmart
2024-11-21,N/A,N/A,N/A,N/A,Walmart
2024-11-21,N/A,N/A,N/A,N/A,Walmart
2024-11-21,N/A,N/A,N/A,N/A,Walmart
2024-11-21,"Great Value Crispy Rice Treats, 40 Count",9.48,30.4 ¢/oz,N/A,Walmart
2024-11-21,"Great Value Chunk Chicken in Water, Chunks, 12.5 Ounce Can; 13 Grams of Protein Per Serving",2.78,$3.56/lb,N/A,Walmart
2024-11-21,"Great Value Batter Mix Seasoned Crinkle Cut French Fried Potatoes, 26 oz Bag (Frozen)",2.97,11.4 ¢/oz,N/A,Walmart
2024-11-21,"Great Value Original French Toast Sticks, 16 oz (Frozen)",3.16,19.8 ¢/oz,N/A,Walmart
2024-11-21,"Great Value Original Peach Lowfat Yogurt, 6 oz, 4 Count",2.34,9.8 ¢/oz,N/A,Walmart
2024-11-21,"Great Value All Purpose Flour, 10LB Bag",4.57,2.9 ¢/oz,N/A,Walmart
2024-11-21,"Great Value Granulated No Calorie Sweetener, 9.7 oz",4.94,50.9 ¢/oz,N/A,Walmart
2024-11-21,"Great Value Deluxe Pasteurized Process Sliced American Cheese, 16 oz, 24 Count",3.97,24.8 ¢/oz,N/A,Walmart
2024-11-21,"Great Value Pizza Sauce, 23.9 oz",1.98,8.3 ¢/oz,N/A,Walmart
2024-11-21,"Great Value Sloppy Joe Sauce, 15 oz",0.98,6.5 ¢/oz,N/A,Walmart
2024-11-21,"Great Value Party Size Original Potato Chips, 13 oz",2.86,22.0 ¢/oz,N/A,Walmart
2024-11-21,"Great Value Golden Sweet Whole Kernel Corn, 8.75 oz Can",0.58,6.6 ¢/oz,N/A,Walmart
2024-11-21,"Great Value Frosted Toaster Pastries, Chocolate Fudge, 20.3 oz, 12 Count",1.97,9.7 ¢/oz,N/A,Walmart
2024-11-21,"Great Value Chocolate Chip Cookie Dough Ice Cream, 48 fl oz",2.87,6.0 ¢/fl oz,N/A,Walmart
2024-11-21,"Great Value Shredded Pepper Jack Cheese, 8 oz",2.24,28.0 ¢/oz,N/A,Walmart
2024-11-21,"Great Value Cinnamon Crunch Breakfast Cereal, 20.25 oz",2.98,14.7 ¢/oz,N/A,Walmart
2024-11-21,"Great Value Unsalted Beef Broth, 32 oz Carton, Shelf-Stable/Ambient, Gluten-Free, Liquid",1.37,4.3 ¢/oz,N/A,Walmart
2024-11-21,"Great Value No Salt Added Golden Sweet Whole Kernel Corn, 15.25 oz",0.64,4.3 ¢/oz,N/A,Walmart
2024-11-21,"Great Value Maraschino Cherries, 16 oz",3.68,23.0 ¢/oz,N/A,Walmart
2024-11-21,"Great Value Frozen Baby Lima Beans, Gluten-Free, 12 oz Steamable Bag",1.62,13.5 ¢/oz,N/A,Walmart
2024-11-21,"Great Value Chocolate Chip Mini Muffins, 16.5 oz (10 count)",5.48,33.2 ¢/oz,N/A,Walmart
2024-11-21,"Great Value Red Bean, 15.5 oz Can",0.86,5.5 ¢/oz,N/A,Walmart
2024-11-21,"Great Value Garlic Salt, 5.7 oz",1.12,$1.12,1.00,Walmart
2024-11-21,"Great Value Fat Free Refried Beans, 16 oz",1.00,6.3 ¢/oz,N/A,Walmart
2024-11-21,"Great Value Block Medium Cheddar Cheese, 16 oz",4.22,26.4 ¢/oz,N/A,Walmart
2024-11-21,"Great Value White Baking Chips, 11 oz Bag",2.97,27.0 ¢/oz,N/A,Walmart
2024-11-21,"Great Value Cheese Ravioli Pasta, 25 oz Bag (Frozen)",4.27,17.1 ¢/oz,N/A,Walmart
2024-11-21,"Great Value Antioxidant Blackberry Lemonade Liquid Drink Mix, Sugar-Free, 1.41 oz, 10 Count",2.24,$2.24,1.98,Walmart
2024-11-21,"Great Value White Basket Coffee Filters, 200 Count",1.86,93.0 ¢/100 ct,N/A,Walmart
2024-11-21,"Great Value Pure Vanilla Extract, 1 fl oz (Ambient, Plastic Container, Liquid)",3.94,$3.94/fl oz,N/A,Walmart
2024-11-21,"Great Value Chocolate Instant Pudding & Pie Filling, 3.9 oz carton",0.98,25.1 ¢/oz,N/A,Walmart
2024-11-21,"Great Value Sweet Potato Fries, 20 oz Bag (Frozen)",3.28,16.4 ¢/oz,N/A,Walmart
2024-11-21,"Great Value Hazelnut Coffee Creamer, 32 fl oz",2.78,8.7 ¢/fl oz,N/A,Walmart
2024-11-21,"Great Value Fruit Spin Loops, Breakfast Cereal, 21.7 oz",2.98,13.7 ¢/oz,N/A,Walmart
2024-11-21,"Great Value Electrolyte Vitamin Enhanced Strawberry Kiwi Drink Mix, 0.08 oz, 10 Count",2.42,$2.42,1.98,Walmart
2024-11-21,"Great Value Twist up Lemon Lime Soda Pop, 12 fl oz, 12 Pack Cans",4.46,3.1 ¢/fl oz,N/A,Walmart
2024-11-21,N/A,N/A,N/A,N/A,Walmart
2024-11-21,"Great Value Sliced Stewed Tomatoes, 14.5 oz",0.96,6.6 ¢/oz,N/A,Walmart
2024-11-21,N/A,N/A,N/A,N/A,Walmart
2024-11-21,"Great Value Organic Reduced Sodium Chicken Broth, 32 oz Carton, Shelf-Stable/Ambient, Liquid",1.96,6.1 ¢/oz,N/A,Walmart
2024-11-21,N/A,N/A,N/A,N/A,Walmart
2024-11-21,"Great Value 4% Milkfat Minimum Small Curd Cottage Cheese, 16 oz",2.24,14.0 ¢/oz,N/A,Walmart
2024-11-21,N/A,N/A,N/A,N/A,Walmart
2024-11-21,GV TATER TOTS 80 OZ,6.98,$7.97,N/A,Walmart
2024-11-21,N/A,N/A,N/A,N/A,Walmart
2024-11-21,"Great Value Original Strawberry Lowfat Yogurt, 32 oz",2.76,8.6 ¢/oz,N/A,Walmart
2024-11-21,N/A,N/A,N/A,N/A,Walmart
2024-11-21,N/A,N/A,N/A,N/A,Walmart
2024-11-21,N/A,N/A,N/A,N/A,Walmart
2024-11-21,N/A,N/A,N/A,N/A,Walmart
2024-11-21,"Great Value Crispy Rice Treats, 40 Count",9.48,30.4 ¢/oz,N/A,Walmart
2024-11-21,"Great Value Mandarin Oranges in Light Syrup, 15 oz",1.34,8.9 ¢/oz,N/A,Walmart
2024-11-21,"Great Value Sweet Potato Fries, 20 oz Bag (Frozen)",3.28,16.4 ¢/oz,N/A,Walmart
2024-11-21,"Great Value Vanilla Creme Wafer Cookies, 8 oz, 1 Count",1.87,23.4 ¢/oz,N/A,Walmart
2024-11-21,"Great Value Magic Treasures Whole Grain Oat with Marshmallow Cereal, 11.5 oz",1.97,17.1 ¢/oz,N/A,Walmart
2024-11-21,"Great Value Pure Vanilla Extract, 2 fl oz (Food Form: Liquid, Plastic Container)",5.72,$2.86/fl oz,N/A,Walmart
2024-11-21,"Great Value Light Apple Juice, 96 fl oz",2.84,3.0 ¢/fl oz,N/A,Walmart
2024-11-21,"Great Value Shredded Medium Cheddar Cheese, 16 oz",4.22,26.4 ¢/oz,N/A,Walmart
2024-11-21,"Great Value Dipping Corn Chips, 9.25 oz Bag",1.97,21.2 ¢/oz,N/A,Walmart
2024-11-21,"Great Value Sour Cream & Onion Flavored Potato Chips Party Size, 12.5 oz",2.86,22.9 ¢/oz,N/A,Walmart
2024-11-21,"Great Value Classic Chocolate Chip Cookies, Family Size, 18.2 oz",3.38,18.6 ¢/oz,N/A,Walmart
2024-11-21,"Great Value No Salt Added Petite Diced Tomatoes, 14.5 oz",0.96,6.6 ¢/oz,N/A,Walmart
2024-11-21,"Great Value Hot Sliced Jalapeo Peppers, 12 Oz",1.97,16.4 ¢/oz,N/A,Walmart
2024-11-21,"Great Value Lactose Free Skim Fat Free Milk, Half Gallon, 64 fl oz",3.38,5.3 ¢/fl oz,N/A,Walmart
2024-11-21,"Great Value Chunk Light Tuna in Water, 12 oz",2.08,17.3 ¢/oz,N/A,Walmart
2024-11-21,"Great Value Maple & Brown Sugar Instant Oatmeal, 1.51 oz, 20 Packets",3.56,11.7 ¢/oz,N/A,Walmart
2024-11-21,Great Value Vienna Sausage,0.76,$2.62/lb,N/A,Walmart
2024-11-21,"Great Value Kettle Cooked Jalapeno Flavored Potato Chips, 8 oz Bag",1.98,24.8 ¢/oz,N/A,Walmart
2024-11-21,"Great Value Peanut Butter Filled Pretzel, 24 oz Resealable and Recyclable Container",5.96,24.8 ¢/oz,N/A,Walmart
2024-11-21,"Great Value Extra Virgin Olive Oil, 17 fl oz",7.57,44.5 ¢/fl oz,N/A,Walmart
2024-11-21,"Great Value Flour Chicken Taquitos, 19.2 oz, 16 Count",4.98,25.9 ¢/oz,N/A,Walmart
2024-11-21,"Great Value Deli Style Sliced Sharp Cheddar Cheese, 16 oz, 24 Slices",4.22,26.4 ¢/oz,N/A,Walmart
2024-11-21,"Great Value Crushed Red Pepper, 1.75 oz",1.44,82.3 ¢/oz,N/A,Walmart
2024-11-21,"Great Value Corned Beef Hash, 14 oz Steel Can",2.80,20.0 ¢/oz,N/A,Walmart
2024-11-21,"Great Value Frozen Raw Medium Peeled Deveined Tail-on Shrimp, 12 oz (41-60 Count per lb)",5.68,47.3 ¢/oz,N/A,Walmart
2024-11-21,"Great Value Fire Roasted Diced Tomatoes with Green Chiles, 10 oz",0.98,9.8 ¢/oz,N/A,Walmart
2024-11-21,"Great Value Fat Free Crispy Pretzel Sticks, 16 oz Bag",2.24,14.0 ¢/oz,N/A,Walmart
2024-11-21,"Great Value Tri-Color Tortilla Strips Salad Topping, 3.5 oz Resealable Bag",1.54,44.0 ¢/oz,N/A,Walmart
2024-11-21,"Great Value Pear Halves in Pear Juice, 15 oz",1.48,9.9 ¢/oz,N/A,Walmart
2024-11-21,"Great Value Breaded Fully Cooked Popcorn Chicken, 25.5 oz (Frozen)",7.47,29.3 ¢/oz,N/A,Walmart
2024-11-21,"Great Value Canned Whole Green Beans, Gluten-Free, 14.5 oz",1.16,8.0 ¢/oz,N/A,Walmart
2024-11-21,"Great Value Shredded Low-Moisture Part-Skim Mozzarella Cheese, 16 oz (Plastic Bag)",4.22,26.4 ¢/oz,N/A,Walmart
2024-11-21,"Great Value Pecan Halves, 8 oz",5.76,72.0 ¢/oz,N/A,Walmart
2024-11-21,"Great Value Frosted Flakes, Breakfast Cereal,13.5 oz",1.93,14.3 ¢/oz,N/A,Walmart
2024-11-21,"Great Value Fruit & Cream Variety Instant Oatmeal Value Pack, 1.05 oz, 20 Packets",3.56,16.9 ¢/oz,N/A,Walmart
2024-11-21,Great Value 16 oz Thick and Chunky Salsa Medium,1.92,12.0 ¢/oz,N/A,Walmart
2024-11-21,"Great Value No Sugar Added Sliced Peaches, 14.5 oz",1.48,10.2 ¢/oz,N/A,Walmart
2024-11-21,"Great Value Garlic & Butter Seasoned Croutons, 5 oz Resealable Bag, Baked from Wheat Bread, Ready-to-eat",1.36,27.2 ¢/oz,N/A,Walmart
2024-11-21,"Great Value Original Ricotta Cheese, 32 oz Tub (Refrigerated)",4.76,14.9 ¢/oz,N/A,Walmart
2024-11-21,"Great Value Cream of Chicken Condensed Soup, Family Size, 26 oz",1.64,6.3 ¢/oz,N/A,Walmart
2024-11-21,"Great Value Root Beer Soda Pop, 12 fl oz, 12 Pack Cans",4.46,3.1 ¢/fl oz,N/A,Walmart
2024-11-21,N/A,N/A,N/A,N/A,Walmart
2024-11-21,N/A,N/A,N/A,N/A,Walmart
2024-11-21,N/A,N/A,N/A,N/A,Walmart
2024-11-21,N/A,N/A,N/A,N/A,Walmart
2024-11-21,"Great Value Crispy Rice Treats, 40 Count",9.48,30.4 ¢/oz,N/A,Walmart
2024-11-21,"Great Value Heart Healthy 98% Fat Free and 50% Less Sodium Cream of Mushroom Condensed Soup, 10.5 oz",0.92,$0.92,0.68,Walmart
2024-11-21,"Great Value Mild Chili Seasoning Mix, 1 oz",0.74,74.0 ¢/oz,N/A,Walmart
2024-11-21,"Great Value Coconut Milk, 13.5 fl oz Can",1.56,11.6 ¢/fl oz,N/A,Walmart
2024-11-21,"Great Value Pork & Beans in Tomato Sauce, 15 oz",0.82,5.5 ¢/oz,N/A,Walmart
2024-11-21,"Great Value Canned Black Eyed Peas, 15.5 oz Can",1.18,7.6 ¢/oz,N/A,Walmart
2024-11-21,"Great Value Original Coffee Creamer, 35.3 oz",5.47,15.5 ¢/oz,N/A,Walmart
2024-11-21,"(12 pack) Great Value Original Macaroni & Cheese, 7.25 oz Shelf Stable",6.96,7.9 ¢/oz,N/A,Walmart
2024-11-21,"Great Value Traditional Italian Salad Dressing & Marinade, 16 fl oz",1.97,12.3 ¢/fl oz,N/A,Walmart
2024-11-21,Great Value Instant Mashed Potatoes 13.75 oz Box,2.12,$2.12,1.88,Walmart
2024-11-21,"Great Value Strawberry Creme Wafer Cookies, 8 oz",1.87,23.4 ¢/oz,N/A,Walmart
2024-11-21,"Great Value Organic Reduced Fat 2% Milk, 1 Gallon",6.98,5.5 ¢/fl oz,N/A,Walmart
2024-11-21,"Great Value Sugar-Free Lemonade Drink Mix Powder, 0.53 oz, 6 Count",2.28,71.3 ¢/oz,N/A,Walmart
2024-11-21,"Great Value Dry Roasted Peanuts, 16 oz",2.48,15.5 ¢/oz,N/A,Walmart
2024-11-21,"Great Value 1% Milkfat Small Curd Lowfat Cottage Cheese, 16 oz",2.24,14.0 ¢/oz,N/A,Walmart
2024-11-21,"Great Value Frozen Appetizers Classic Corn Dogs, 16 oz, 6 Count (Frozen). Contains Wheat, Milk, Eggs and Soy",3.43,21.4 ¢/oz,N/A,Walmart
2024-11-21,"Great Value Turkey Pepperoni Slices, 5 oz",2.98,$9.61/lb,N/A,Walmart
2024-11-21,"Great Value Organic Tomato Ketchup, 20 oz",2.18,10.9 ¢/oz,N/A,Walmart
2024-11-21,"Great Value All-Purpose Unbleached Flour, 5LB Bag",2.43,3.0 ¢/oz,N/A,Walmart
2024-11-21,"Great Value Plain Bread Crumbs, 15 oz",1.22,8.1 ¢/oz,N/A,Walmart
2024-11-21,"Great Value Regular Buttermilk Biscuits, 10 Count, 4 Pack",2.97,39.6 ¢/oz,N/A,Walmart
2024-11-21,"Great Value Pumpkin Pie Spice, 2 oz",2.37,$1.19/oz,N/A,Walmart
2024-11-21,"Great Value Cubed Mild Cheddar Cheese, 8 oz",2.37,29.6 ¢/oz,N/A,Walmart
2024-11-21,"Great Value Rising Crust Three Meat Pizza, 29.45 oz (Frozen)",4.97,16.8 ¢/oz,N/A,Walmart
2024-11-21,"Great Value Cheese Wow! Spray Cheese, Cheddar, 8 oz Can",2.57,32.1 ¢/oz,N/A,Walmart
2024-11-21,"Great Value Blueberries, 48 oz (Frozen)",7.24,15.1 ¢/oz,N/A,Walmart
2024-11-21,"Great Value Kosher Basil Leaves, 0.8 oz",1.12,$1.12,1.00,Walmart
2024-11-21,"Great Value Maraschino Cherries, 10 oz",2.77,27.7 ¢/oz,N/A,Walmart
2024-11-21,"Great Value Extra Sharp Cheddar Cheese, 8 oz",2.24,28.0 ¢/oz,N/A,Walmart
2024-11-21,"Great Value Chocolate & Vanilla Ice Cream Cups, 36 fl oz 12 Pack",4.17,11.6 ¢/fl oz,N/A,Walmart
2024-11-21,"Great Value Garlic Pepper Crispy Onions Salad Topping, 3.5 oz Resealable Bag",1.54,44.0 ¢/oz,N/A,Walmart
2024-11-21,"Great Value Original Strawberry and Peach Lowfat Yogurt, 6 oz Cups, 12 Count",5.97,8.3 ¢/oz,N/A,Walmart
2024-11-21,"Great Value Pineapple Chunks, Frozen, 16 oz",2.47,15.4 ¢/oz,N/A,Walmart
2024-11-21,"Great Value Sweetened Coconut Flakes, 14 oz (396g)",2.98,21.3 ¢/oz,N/A,Walmart
2024-11-21,"Great Value Original Pepperoni Mega Pack, 21 oz",8.23,$6.28/lb,N/A,Walmart
2024-11-21,"Great Value Pre-Sliced Cinnamon Raisin Bread, 16 oz",2.47,15.4 ¢/oz,N/A,Walmart
2024-11-21,"Great Value Minced Garlic in Extra Virgin Olive Oil, 8 oz",2.66,33.3 ¢/oz,N/A,Walmart
2024-11-21,"Great Value Chopped Pecans, 16 oz",12.67,$12.67,9.97,Walmart
2024-11-21,"Great Value Fully Cooked Homestyle Ground Chicken Fries, 27.5 oz Bag (Frozen)",6.98,$4.06/lb,N/A,Walmart
2024-11-21,"Great Value Pineapple 100% Juice, 64 fl oz",3.97,6.2 ¢/fl oz,N/A,Walmart
2024-11-21,Great Value Banana Cream Instant Pudding & Pie Filling in a 3.4 oz Carton,0.98,28.8 ¢/oz,N/A,Walmart
2024-11-21,N/A,N/A,N/A,N/A,Walmart
2024-11-21,N/A,N/A,N/A,N/A,Walmart
2024-11-21,N/A,N/A,N/A,N/A,Walmart
2024-11-21,"Great Value Crispy Rice Treats, 40 Count",9.48,30.4 ¢/oz,N/A,Walmart
2024-11-21,"Great Value Canola Oil, 1 gal",9.98,7.8 ¢/fl oz,N/A,Walmart
2024-11-21,"Great Value Butter Pecan Ice Cream, 48 fl oz",2.87,6.0 ¢/fl oz,N/A,Walmart
2024-11-21,"Great Value Cinnamon French Toast Bites, 16 oz (Frozen)",3.16,19.8 ¢/oz,N/A,Walmart
2024-11-21,"Great Value Rising Crust Cheese Pizza, 28.10 oz (Frozen)",4.97,17.7 ¢/oz,N/A,Walmart
2024-11-21,"Great Value Frozen Apple Juice, 12 fl oz",1.27,10.6 ¢/fl oz,N/A,Walmart
2024-11-21,"Great Value Chocolate Flavored Candy Coating Almond Bark, 24 oz",3.97,16.5 ¢/oz,N/A,Walmart
2024-11-21,"Great Value Whole Peeled Tomatoes, 28 oz",1.48,5.3 ¢/oz,N/A,Walmart
2024-11-21,"Great Value Stuffed Manzanilla Olives with Minced Pimento, 10 oz Jar",2.52,25.2 ¢/oz,N/A,Walmart
2024-11-21,"Great Value Mini Vanilla Flavored Ice Cream Sandwiches, 36.8 fl oz 16 Pack",2.88,7.8 ¢/fl oz,N/A,Walmart
2024-11-21,"Great Value Extra Butter Flavored Microwave Popcorn, 2.55 oz, 12 Count",4.82,$4.82,4.36,Walmart
2024-11-21,"Great Value Family Size Cheese Ravioli Pasta, 48 oz Bag (Frozen)",6.77,14.1 ¢/oz,N/A,Walmart
2024-11-21,"Great Value Fudge Tracks Ice Cream, 48 fl oz",2.87,6.0 ¢/fl oz,N/A,Walmart
2024-11-21,"Great Value Garden Vegetable Cream Cheese Spread, 8 oz Tub",2.27,28.4 ¢/oz,N/A,Walmart
2024-11-21,"Great Value Duplex Sandwich Crme Cookies Family Size, 25 oz",2.58,10.3 ¢/oz,N/A,Walmart
2024-11-21,"Great Value White Mushrooms Pieces and Stems, 6.5 oz",1.28,19.7 ¢/oz,N/A,Walmart
2024-11-21,"Great Value Whole Milk Mozzarella Cheese, 16 oz Vacuum Pack",3.74,23.4 ¢/oz,N/A,Walmart
2024-11-21,"Great Value Poultry Seasoning, 1.5 oz",2.00,$1.33/oz,N/A,Walmart
2024-11-21,"Great Value Complete Pancake & Waffle Mix, Extra Fluffy, Original, 32 oz",1.98,6.2 ¢/oz,N/A,Walmart
2024-11-21,"Great Value Thin Spaghetti Pasta, 32 oz",1.92,6.0 ¢/oz,N/A,Walmart
2024-11-21,"Great Value Honey Nut O's Oat Breakfast Cereal, 21.6 oz",2.97,13.8 ¢/oz,N/A,Walmart
2024-11-21,"Great Value Colby & Monterey Jack Cheese Sticks, 0.75 oz, 36 Count Bag (Plastic Packaging)",8.98,33.3 ¢/oz,N/A,Walmart
2024-11-21,"Great Value Hickory Smoked Lower Sodium Bacon, 16 oz",5.48,$5.48/lb,N/A,Walmart
2024-11-21,"Great Value Salt & Vinegar Potato Chips, 7.75 oz Bag",1.98,$1.98,1.50,Walmart
2024-11-21,"Great Value Cornbread Stuffing Mix, 6 oz",0.97,16.2 ¢/oz,N/A,Walmart
2024-11-21,"Great Value Berry Punch, 59 oz",1.82,3.1 ¢/fl oz,N/A,Walmart
2024-11-21,"Great Value Whole Pepperoncini, 12 fl oz",1.97,15.8 ¢/fl oz,N/A,Walmart
2024-11-21,"Great Value Sharp Cheddar Cheese Sticks, 9 oz, 12 Count",3.46,38.4 ¢/oz,N/A,Walmart
2024-11-21,"Great Value Pinto Beans, 32 oz",1.98,6.2 ¢/oz,N/A,Walmart
2024-11-21,"Great Value Flaky Jumbo Buttermilk Biscuits, 8 Count",1.97,12.3 ¢/oz,N/A,Walmart
2024-11-21,"Great Value Dried Cranberries & Candied Pecans, 3.5 oz",2.12,60.6 ¢/oz,N/A,Walmart
2024-11-21,"Great Value Crispy Battered Fish Fillets, 19 oz, 10 Count (Frozen)",5.44,28.6 ¢/oz,N/A,Walmart
2024-11-21,"Great Value 100% Pure Beef Burgers, 75% Lean/25% Fat, 3 lbs, 12 Count (Frozen)",11.97,$3.99/lb,N/A,Walmart
2024-11-21,"Great Value Garlic Knots, 8 oz, 6 Count (Frozen)",2.78,34.8 ¢/oz,N/A,Walmart
2024-11-21,"Great Value Original Breakfast Sausage, 24.92 oz",8.36,$5.36/lb,N/A,Walmart
2024-11-21,"Great Value Sugar-Free Grape Powdered Drink Mix, 0.77 oz, 10 Packets",2.24,$2.24,1.98,Walmart
2024-11-21,"Great Value Sliced Strawberries, 64 oz (Frozen)",9.22,14.4 ¢/oz,N/A,Walmart
2024-11-21,Great Value Pepperoni & Cheese Filled Sandwiches 2 Count,1.98,22.0 ¢/oz,N/A,Walmart
2024-11-21,N/A,N/A,N/A,N/A,Walmart
2024-11-21,"Great Value Cream Soda Pop, 12 fl oz, 12 Pack Cans",4.46,3.1 ¢/fl oz,N/A,Walmart
2024-11-21,N/A,N/A,N/A,N/A,Walmart
2024-11-21,"Great Value Dr Thunder Soda Pop, 12 fl oz, 12 Pack Cans",4.46,3.1 ¢/fl oz,N/A,Walmart
2024-11-21,N/A,N/A,N/A,N/A,Walmart
2024-11-21,N/A,N/A,N/A,N/A,Walmart
2024-11-21,N/A,N/A,N/A,N/A,Walmart
2024-11-21,N/A,N/A,N/A,N/A,Walmart
2024-11-21,"Great Value Crispy Rice Treats, 40 Count",9.48,30.4 ¢/oz,N/A,Walmart
2024-11-21,"Great Value Tomato 100% Juice, 64 fl oz",3.28,5.1 ¢/fl oz,N/A,Walmart
2024-11-21,"Great Value Pickled Sliced Beets, Gluten-Free, 15 oz",1.16,7.7 ¢/oz,N/A,Walmart
2024-11-21,"Great Value Hazelnut Spread, 13 oz",2.87,22.1 ¢/oz,N/A,Walmart
2024-11-21,"Great Value Original Sugar Free Whipped Topping, 6.5 oz",2.20,33.8 ¢/oz,N/A,Walmart
2024-11-21,"Great Value Garlic Knots, 8 oz, 6 Count (Frozen)",2.78,34.8 ¢/oz,N/A,Walmart
2024-11-21,"Great Value Breaded Fish Sticks, 24.7 oz, 44 Count (Frozen)",5.44,22.0 ¢/oz,N/A,Walmart
2024-11-21,"Great Value Pepperoni Pizza Snack Rolls, 65 oz, 130 Count Frozen",9.83,15.1 ¢/oz,N/A,Walmart
2024-11-21,"Great Value Pinto Beans, No Salt Added, 15.5 oz",0.86,5.5 ¢/oz,N/A,Walmart
