date,item_name,price,price_per_unit,sale_price,store
2024-08-22,"Wegmans Seedless Cucumbers, FAMILY PACK",4.99 /ea,3 ct ($1.66/ct,N/A,Wegmans
2024-08-22,"Wegmans Grape Tomatoes, FAMILY PACK",3.99 /ea,1 qt ($3.99/qt,N/A,Wegmans
2024-08-22,Wegmans Chopped Romaine,2.99 /ea,10 oz bag ($0.30/oz bag,N/A,Wegmans
2024-08-22,Wegmans Cleaned & Cut Microwavable Trimmed Green Beans,2.99 /ea,12 oz bag ($0.25/oz bag,N/A,Wegmans
2024-08-22,Wegmans Mini Seedless Cucumbers,2.50 /ea,14 oz ($0.18/oz,N/A,Wegmans
2024-08-22,Wegmans Plum (Roma) Tomatoes (Avg. 0.22lb),0.43 /ea,$1.99/lb,N/A,Wegmans
2024-08-22,Wegmans Romaine Salad,2.49 /ea,10 oz ($0.25/oz,N/A,Wegmans
2024-08-22,Wegmans Organic Baby Cut Carrots,1.69 /ea,16 oz bag ($0.11/oz bag,N/A,Wegmans
2024-08-22,"Wegmans Lemons, Bagged",4.49 /ea,32 oz bag ($0.14/oz bag,N/A,Wegmans
2024-08-22,Wegmans Cleaned & Cut Microwaveable Broccoli Florets,2.79 /ea,12 oz bag ($0.23/oz bag,N/A,Wegmans
2024-08-22,"Wegmans Cherry Tomatoes on the Vine, Flavor Bombs",5.79 /ea,12 oz ($0.48/oz,N/A,Wegmans
2024-08-22,"Wegmans Brussels Sprouts, FAMILY PACK",5.49 /ea,2 lb bag ($2.75/lb bag,N/A,Wegmans
2024-08-22,Wegmans Butter Lettuce Salad,2.69 /ea,6 oz bag ($0.45/oz bag,N/A,Wegmans
2024-08-22,Wegmans Shredded Iceberg Lettuce,1.50 /ea,10 oz bag ($0.15/oz bag,N/A,Wegmans
2024-08-22,"Wegmans Gala Apples, Bagged",2.99 /ea,48 oz bag ($0.06/oz bag,N/A,Wegmans
2024-08-22,Wegmans Spring Mix Salad,2.50 /ea,5 oz bag ($0.50/oz bag,N/A,Wegmans
2024-08-22,Wegmans Organic Baby Arugula,3.29 /ea,5 oz container ($0.66/oz container,N/A,Wegmans
2024-08-22,Wegmans Sugar Bombs Grape Tomatoes on the Vine,5.79 /ea,12 oz ($0.48/oz,N/A,Wegmans
2024-08-22,"Wegmans Potatoes, Butter (Gold)",5.99 /ea,5 lb bag ($1.20/lb bag,N/A,Wegmans
2024-08-22,Wegmans Bartlett Pears (Avg. 0.52lb),1.03 /ea,$1.99/lb,N/A,Wegmans
2024-08-22,"Wegmans Honeycrisp Apples, Bagged",6.99 /ea,48 oz bag ($0.15/oz bag,N/A,Wegmans
2024-08-22,Wegmans Organic Petite Carrots,2.29 /ea,12 oz bag ($0.19/oz bag,N/A,Wegmans
2024-08-22,"Wegmans Trimmed Green Beans, FAMILY PACK",5.99 /ea,32 oz bag ($0.19/oz bag,N/A,Wegmans
2024-08-22,Wegmans Campari Cocktail Tomatoes,3.99 /ea,16 oz container ($0.25/oz container,N/A,Wegmans
2024-08-22,"Wegmans Organic Mixed Peppers, FAMILY PACK",6.49 /ea,N/A,N/A,Wegmans
2024-08-22,"Wegmans Romaine Salad, FAMILY PACK",4.79 /ea,20 oz bag ($0.24/oz bag,N/A,Wegmans
2024-08-22,Wegmans Whole Baby Bella Mushrooms,2.99 /ea,10 oz container ($0.30/oz container,N/A,Wegmans
2024-08-22,Wegmans Cole Slaw,2.00 /ea,16 oz bag ($0.13/oz bag,N/A,Wegmans
2024-08-22,Wegmans Organic Baby Spinach,3.29 /ea,5 oz container ($0.66/oz container,N/A,Wegmans
2024-08-22,Wegmans Celery Sticks,2.79 /ea,8 oz bag ($0.35/oz bag,N/A,Wegmans
2024-08-22,Wegmans Fresh Cut Seedless Watermelon (Avg. 3.54lb),5.27 /ea,$1.49/lb,N/A,Wegmans
2024-08-22,"Wegmans Cleaned & Cut Broccoli Florets, FAMILY PACK",6.49 /ea,3 lb bag ($2.16/lb bag,N/A,Wegmans
2024-08-22,Wegmans Organic Carrot Chips,2.29 /ea,16 oz bag ($0.14/oz bag,N/A,Wegmans
2024-08-22,"Wegmans Basil, Fresh Living",3.99 /ea,1 each ($3.99/each,N/A,Wegmans
2024-08-22,"Wegmans Onions, Red",4.49 /ea,2 lb bag ($2.25/lb bag,N/A,Wegmans
2024-08-22,Wegmans Baby Gold Potatoes,3.99 /ea,24 oz bag ($0.17/oz bag,N/A,Wegmans
2024-08-22,Wegmans Microwaveable Asparagus Tips,2.99 /ea,8 oz bag ($0.37/oz bag,N/A,Wegmans
2024-08-22,"Wegmans Medley Snacking Tomatoes, FAMILY PACK",6.49 /ea,1.5 lb ($4.33/lb,N/A,Wegmans
2024-08-22,Wegmans Baby Arugula Salad,2.69 /ea,5 oz bag ($0.54/oz bag,N/A,Wegmans
2024-08-22,"Wegmans Sliced Baby Bella Mushrooms, FAMILY PACK",4.99 /ea,20 oz container ($0.25/oz container,N/A,Wegmans
2024-08-22,"Wegmans Organic Spinach Spring Mix, FAMILY PACK",4.99 /ea,11 oz container ($0.45/oz container,N/A,Wegmans
2024-08-22,Wegmans Greenhouse Grown Orange Peppers (Avg. 0.45lb),1.55 /ea,1 per lb ($3.49/lb,N/A,Wegmans
2024-08-22,"Wegmans Whole Baby Bella Mushrooms, FAMILY PACK",4.99 /ea,24 oz ($0.21/oz,N/A,Wegmans
2024-08-22,Wegmans Organic Carrots,1.49 /ea,16 oz ($0.09/oz,N/A,Wegmans
2024-08-22,"Wegmans Organic Baby Spinach, FAMILY PACK",4.99 /ea,11 oz container ($0.45/oz container,N/A,Wegmans
2024-08-22,"Wegmans Kale Greens, Cut",2.99 /ea,16 oz bag ($0.19/oz bag,N/A,Wegmans
2024-08-22,"Wegmans Organic Baby Cut Carrots, FAMILY PACK",3.29 /ea,32 oz bag ($0.10/oz bag,N/A,Wegmans
2024-08-22,"Wegmans Potatoes, Red",5.99 /ea,5 lb bag ($1.20/lb bag,N/A,Wegmans
2024-08-22,Wegmans Romaine Hearts,3.49 /ea,22 oz ($0.16/oz,N/A,Wegmans
2024-08-22,Wegmans Fresh Garden Salad,1.99 /ea,16 oz ($0.12/oz,N/A,Wegmans
2024-08-22,"Wegmans Baby Cut Carrots, FAMILY PACK",2.79 /ea,48 oz bag ($0.06/oz bag,N/A,Wegmans
date,item_name,price,price_per_unit,sale_price,store
2024-08-22,Wegmans In-Store Fresh Baked Bagel,1.29 /ea,N/A,N/A,Wegmans
2024-08-22,Wegmans In-Store Baked Donuts,1.29 /ea,N/A,N/A,Wegmans
2024-08-22,Wegmans Cookies by the Pound,14.49 /lb,N/A,N/A,Wegmans
2024-08-22,Wegmans Bulk Muffins,1.89 /ea,N/A,N/A,Wegmans
2024-08-22,Wegmans French Baguette,3.75 /ea,12 oz ($0.31/oz,N/A,Wegmans
2024-08-22,Wegmans Sourdough Loaf,6.50 /ea,17 oz ($0.38/oz,N/A,Wegmans
2024-08-22,"Wegmans Soft Plain Bagels, 6 Count",N/A,20 oz ($0.15/oz,N/A,Wegmans
2024-08-22,Wegmans 6 Pack Everything Bagels,7.75 /ea,21 oz ($0.37/oz,N/A,Wegmans
2024-08-22,"Wegmans Everything Soft Bagels, 6 Count",N/A,20 oz ($0.15/oz,N/A,Wegmans
2024-08-22,"Wegmans Organic Rosemary Sourdough Bread, Whole Loaf",6.50 /ea,18 oz ($0.36/oz,N/A,Wegmans
2024-08-22,"Wegmans Ultimate Chocolate Chip Cookies, 15 pk",16.00 /ea,17 oz ($0.94/oz,N/A,Wegmans
2024-08-22,"Wegmans Ultimate Chocolate Chip Cookies, 5 pk",6.50 /ea,5 oz ($1.30/oz,N/A,Wegmans
2024-08-22,"Wegmans Croissant, Large, Plain 4 Pack",8.00 /ea,6 oz ($1.33/oz,N/A,Wegmans
2024-08-22,Wegmans Giant White Bread,1.29 /ea,22 oz ($0.06/oz,N/A,Wegmans
2024-08-22,"Wegmans Hot Dog Rolls, 8 Pack",1.39 /ea,14 oz ($0.10/oz,N/A,Wegmans
2024-08-22,"Wegmans Hamburger Rolls, 8 Pack",1.39 /ea,14 oz ($0.10/oz,N/A,Wegmans
2024-08-22,"Wegmans Sourdough, Half Loaf",3.75 /ea,9 oz ($0.42/oz,N/A,Wegmans
2024-08-22,Wegmans Cut Out Sugar Cookies by the Pound (Avg. 0.64lb),9.27 /ea,$14.49/lb,N/A,Wegmans
2024-08-22,"Wegmans Ultimate Chocolate Chip Cookies, 2 pk",3.00 /ea,2 oz ($1.50/oz,N/A,Wegmans
2024-08-22,"Wegmans Kaiser Rolls, 4 Pack",4.25 /ea,8 oz ($0.53/oz,N/A,Wegmans
2024-08-22,"Wegmans Cinnamon Raisin Swirl Soft Bagels, 6 Count",N/A,20 oz ($0.15/oz,N/A,Wegmans
2024-08-22,Wegmans 6 Pack Sesame Bagels,7.75 /ea,21 oz ($0.37/oz,N/A,Wegmans
2024-08-22,"Wegmans Ciabatta Bread, Whole Loaf",5.50 /ea,10 oz ($0.55/oz,N/A,Wegmans
2024-08-22,Wegmans Pretzel Bites Tub,7.00 /ea,12 oz ($0.58/oz,N/A,Wegmans
2024-08-22,Wegmans Marble Rye Bread,5.50 /ea,16 oz ($0.34/oz,N/A,Wegmans
2024-08-22,"Wegmans Organic Rosemary Sourdough Bread, Half Loaf",3.75 /ea,8 oz ($0.47/oz,N/A,Wegmans
2024-08-22,Wegmans Soft 100% Whole Wheat Bread,2.49 /ea,20 oz ($0.12/oz,N/A,Wegmans
2024-08-22,Wegmans Challah Bread,6.00 /ea,16 oz ($0.38/oz,N/A,Wegmans
2024-08-22,Wegmans Bulk Rolls,1.10 /ea,1 each ($1.10/each,N/A,Wegmans
2024-08-22,Wegmans Sliced French Baguette,3.75 /ea,12 oz ($0.31/oz,N/A,Wegmans
2024-08-22,"Wegmans Garlic Naan, 2 Count",3.49 /ea,8.8 oz ($0.40/oz,N/A,Wegmans
2024-08-22,"Wegmans Muffins, Blueberry, 4 Pack",7.25 /ea,19 oz ($0.38/oz,N/A,Wegmans
2024-08-22,"Wegmans Traditional Naan, 2 Pack",3.49 /ea,8.8 oz ($0.40/oz,N/A,Wegmans
2024-08-22,"Wegmans Blueberry Soft Bagels, 6 Count",N/A,20 oz ($0.15/oz,N/A,Wegmans
2024-08-22,Wegmans Organic Sixseed Bread,6.50 /ea,15 oz ($0.43/oz,N/A,Wegmans
2024-08-22,"Wegmans Muffins, Chocolate Chip, 4 Pack",7.25 /ea,19 oz ($0.38/oz,N/A,Wegmans
2024-08-22,"Wegmans Mini Iced Assorted Cupcakes, 12 Pack",7.00 /ea,10 oz ($0.70/oz,N/A,Wegmans
2024-08-22,Wegmans 6 Pack Plain Bagels,7.75 /ea,21 oz ($0.37/oz,N/A,Wegmans
2024-08-22,Wegmans Mega-Chunk Chocolate Chunk Cookies,5.00 /ea,14 oz ($0.36/oz,N/A,Wegmans
2024-08-22,"Wegmans Super Soft Vienna Rolls, 4 Pack",4.25 /ea,10 oz ($0.43/oz,N/A,Wegmans
2024-08-22,Wegmans White Bread Made with Whole Grain,2.49 /ea,21 oz ($0.12/oz,N/A,Wegmans
2024-08-22,"Wegmans Mini Cheese Filled Cannolis, 4pk",5.50 /ea,4 x 4 oz ($1.38/ea,N/A,Wegmans
2024-08-22,"Wegmans Traditional Mini Naan, 12 Count",6.99 /ea,21.15 oz ($0.33/oz,N/A,Wegmans
2024-08-22,Wegmans Strawberry Shortcake Slice,6.00 /ea,7 oz ($0.86/oz,N/A,Wegmans
2024-08-22,Wegmans 1 Layer Fruit Topped Shortcake,18.00 /ea,25 oz ($0.72/oz,N/A,Wegmans
2024-08-22,"Wegmans Scones, Mini, Wild Blueberry",5.00 /ea,9.52 oz ($0.53/oz,N/A,Wegmans
2024-08-22,"Wegmans Apple Fritter, 4 Pack",5.00 /ea,12 oz ($0.42/oz,N/A,Wegmans
2024-08-22,Wegmans Ultimate Chocolate Cake Slice,6.00 /ea,5 oz ($1.20/oz,N/A,Wegmans
2024-08-22,Wegmans Mini Ultimate Chocolate Cake with Chocolate Icing,12.00 /ea,15 oz ($0.80/oz,N/A,Wegmans
2024-08-22,Wegmans Organic Under the Tuscan Sun Garlic Bread,6.00 /ea,13 oz ($0.46/oz,N/A,Wegmans
2024-08-22,Wegmans Caraway Rye Bread,5.50 /ea,16 oz ($0.34/oz,N/A,Wegmans
2024-08-22,"Wegmans White English Muffins, 6 Count",1.99 /ea,15 oz ($0.13/oz,N/A,Wegmans
2024-08-22,"Wegmans Mega-Chunk Chocolate Chunk Cookies, FAMILY PACK",7.00 /ea,28 oz ($0.25/oz,N/A,Wegmans
2024-08-22,Wegmans Soft Honey Wheat Bread,2.49 /ea,20 oz ($0.12/oz,N/A,Wegmans
2024-08-22,"Wegmans Mini Scones, Orange Cranberry",5.00 /ea,9.52 oz ($0.53/oz,N/A,Wegmans
2024-08-22,"Wegmans Muffins, French Vanilla, 4 Pack",7.25 /ea,18 oz ($0.40/oz,N/A,Wegmans
2024-08-22,"Wegmans French Macarons, 12 Pack",12.00 /ea,5 oz ($2.40/oz,N/A,Wegmans
2024-08-22,Wegmans Mini Chocolate Chip Cookies,5.00 /ea,14 oz ($0.36/oz,N/A,Wegmans
2024-08-22,Wegmans Mini Chocolate Chip Muffins Made with 100% Whole Wheat Flour,5.00 /ea,13.5 oz ($0.37/oz,N/A,Wegmans
2024-08-22,"Wegmans Traditional Naan, FAMILY PACK",7.99 /ea,26.45 oz ($0.30/oz,N/A,Wegmans
date,item_name,price,price_per_unit,sale_price,store
2024-08-22,"Wegmans Cheese, Feta, Crumbled, Plain",3.99 /ea,6 oz ($0.67/oz,N/A,Wegmans
2024-08-22,Wegmans Italian Classics Fresh Mozzarella Cheese,4.99 /ea,8 oz ($0.62/oz,N/A,Wegmans
2024-08-22,Wegmans Fresh Mozzarella Cheese,N/A,16 oz ($0.34/oz,N/A,Wegmans
2024-08-22,Wegmans Milky Mild Blue Cheese Crumbles,3.99 /ea,5 oz ($0.80/oz,N/A,Wegmans
2024-08-22,Wegmans Italian Classics Fresh Mozzarella Cheese,9.29 /ea,32 oz ($0.29/oz,N/A,Wegmans
2024-08-22,"Wegmans Kalamata Olives, Pits Removed (Avg. 0.57lb)",6.83 /ea,$11.99/lb,N/A,Wegmans
2024-08-22,"Wegmans Cave-Ripened Mild Brie Cheese, Milky (Avg. 0.56lb)",10.63 /ea,$18.99/lb,N/A,Wegmans
2024-08-22,Wegmans Italian Classics Pecorino Romano Cheese -Grated (Avg. 0.51lb),10.19 /ea,$19.99/lb,N/A,Wegmans
2024-08-22,"Wegmans Castelvetrano Olives, Pits Removed (Avg. 0.65lb)",7.79 /ea,$11.99/lb,N/A,Wegmans
2024-08-22,Wegmans Basil Pesto (Avg. 0.8lb),9.59 /ea,$11.99/lb,N/A,Wegmans
2024-08-22,Wegmans Fresh Crumbled Goat Cheese,5.49 /ea,4 oz ($1.37/oz,N/A,Wegmans
2024-08-22,"Wegmans Cheese, Feta, in Brine, Plain",3.99 /ea,8 oz ($0.50/oz,N/A,Wegmans
2024-08-22,Wegmans Fresh Goat Cheese Mild,4.29 /ea,4 oz ($1.07/oz,N/A,Wegmans
2024-08-22,Wegmans Italian Classics Burrata Cheese,8.99 /ea,8 oz ($1.12/oz,N/A,Wegmans
2024-08-22,"Wegmans Jubilee Olives, Pits Removed (Avg. 0.64lb)",8.31 /ea,$12.99/lb,N/A,Wegmans
2024-08-22,Wegmans Italian Classics Parmigiano Reggiano Cheese- Grated (Avg. 0.51lb),11.72 /ea,$22.99/lb,N/A,Wegmans
2024-08-22,Wegmans Mild Gorgonzola Crumbles,3.99 /ea,5 oz ($0.80/oz,N/A,Wegmans
2024-08-22,"Wegmans 26 Month Aged Cheddar Cheese, Intense (Avg. 0.63lb)",11.33 /ea,$17.99/lb,N/A,Wegmans
2024-08-22,Wegmans Italian Classics Parmigiano Reggiano Cheese (Avg. 0.54lb),11.33 /ea,$20.99/lb,N/A,Wegmans
2024-08-22,"Wegmans Cave-Ripened Medium Brie Cheese, Buttery (Avg. 0.61lb)",11.58 /ea,$18.99/lb,N/A,Wegmans
2024-08-22,Wegmans Mild Red Wax Gouda Cheese (Avg. 0.84lb),10.07 /ea,$11.99/lb,N/A,Wegmans
2024-08-22,"Wegmans Cheese, Feta, Crumbled, Plain, Fat Free",3.99 /ea,6 oz ($0.67/oz,N/A,Wegmans
2024-08-22,Wegmans Garlic and Herb Cheese Spread,6.99 /ea,10 oz ($0.70/oz,N/A,Wegmans
2024-08-22,Wegmans Cave-Ripened Mild Triple Crème Cheese (Avg. 0.54lb),12.95 /ea,$23.99/lb,N/A,Wegmans
2024-08-22,"Wegmans Cheese, Feta, Crumbled, Plain, FAMILY PACK",7.99 /ea,16 oz ($0.50/oz,N/A,Wegmans
2024-08-22,Wegmans Danny's Favorite Olive Mix (Avg. 0.67lb),8.70 /ea,$12.99/lb,N/A,Wegmans
2024-08-22,Wegmans Artichoke Asiago Cheese Spread,6.99 /ea,10 oz ($0.70/oz,N/A,Wegmans
2024-08-22,Wegmans Italian Classics Parmigiano Reggiano Cheese -Shredded (Avg. 0.42lb),9.66 /ea,$22.99/lb,N/A,Wegmans
2024-08-22,Wegmans Aged 6 Months Manchego Cheese- Medium (Avg. 0.62lb),13.01 /ea,$20.99/lb,N/A,Wegmans
2024-08-22,Wegmans 12 Month Aged Cheddar Cheese- Mild (Avg. 0.68lb),5.43 /ea,$7.99/lb,N/A,Wegmans
2024-08-22,Wegmans Sea Salt Marcona Almonds (Avg. 0.83lb),18.25 /ea,$21.99/lb,N/A,Wegmans
2024-08-22,Wegmans Italian Classics Pecorino Romano Cheese -Shredded (Avg. 0.4lb),8.00 /ea,$19.99/lb,N/A,Wegmans
2024-08-22,Wegmans 16-18 Month Aged White Cheddar Cheese (Avg. 0.75lb),9.74 /ea,$12.99/lb,N/A,Wegmans
2024-08-22,Wegmans Dolmas (Stuffed Grape Leaves) (Avg. 0.69lb),8.27 /ea,$11.99/lb,N/A,Wegmans
2024-08-22,"Wegmans Gruyere Cheese AGed 4-6 Months, Shredded Mild (Avg. 0.42lb)",6.72 /ea,$15.99/lb,N/A,Wegmans
2024-08-22,Wegmans Caramelized Pecans (Avg. 0.73lb),16.78 /ea,$22.99/lb,N/A,Wegmans
2024-08-22,Wegmans 12 Month Aged Orange Cheddar Cheese (Avg. 0.71lb),5.67 /ea,1 per lb ($7.99/lb,N/A,Wegmans
2024-08-22,"Wegmans Fresh Goat Cheese Mild, FAMILY PACK",8.49 /ea,8 oz ($1.06/oz,N/A,Wegmans
2024-08-22,Wegmans Sweet Piquante Peppadew Peppers (Avg. 0.5lb),7.00 /ea,$13.99/lb,N/A,Wegmans
2024-08-22,Wegmans Roasted Red Tomatoes (Avg. 0.69lb),8.27 /ea,$11.99/lb,N/A,Wegmans
2024-08-22,Wegmans Buffalo-Style Cheddar Cheese Spread,6.99 /ea,10 oz ($0.70/oz,N/A,Wegmans
2024-08-22,Wegmans Butter Boy French Butter (Avg. 0.3lb),6.60 /ea,$21.99/lb,N/A,Wegmans
2024-08-22,Wegmans Mild Gruyere Swiss Cheese (Avg. 0.68lb),9.51 /ea,$13.99/lb,N/A,Wegmans
2024-08-22,Wegmans Greek Feta & Olive Salad (Avg. 0.65lb),7.79 /ea,$11.99/lb,N/A,Wegmans
2024-08-22,"Wegmans EZ Entertaining Tray, Appetizer Size (Avg. 0.69lb)",11.03 /ea,$15.99/lb,N/A,Wegmans
2024-08-22,Wegmans Italian Classics Pecorino Romano Cheese (Avg. 0.66lb),11.87 /ea,$17.99/lb,N/A,Wegmans
2024-08-22,Wegmans Medium Le Gruyere Swiss Cheese Quarter (Avg. 0.66lb),12.53 /ea,$18.99/lb,N/A,Wegmans
2024-08-22,Wegmans 16-18 Month Aged Orange Cheddar Cheese (Avg. 0.75lb),9.74 /ea,$12.99/lb,N/A,Wegmans
2024-08-22,Wegmans Pimento Cheese Spread,6.99 /ea,10 oz ($0.70/oz,N/A,Wegmans
2024-08-22,Wegmans 18 Month Medium Gouda Cheese (Avg. 0.71lb),12.77 /ea,$17.99/lb,N/A,Wegmans
2024-08-22,"Wegmans Cheese, Feta, Crumbled, Mediterranean Herb",3.99 /ea,6 oz ($0.67/oz,N/A,Wegmans
2024-08-22,"Wegmans Organic Cheese, Feta, Crumbled, Plain",5.99 /ea,6 oz ($1.00/oz,N/A,Wegmans
2024-08-22,"Wegmans EZ Entertaining Tray, Half Size (Avg. 1.52lb)",25.82 /ea,$16.99/lb,N/A,Wegmans
2024-08-22,Wegmans Bon Vivant (Avg. 0.55lb),11.54 /ea,$20.99/lb,N/A,Wegmans
2024-08-22,N/A,N/A,N/A,N/A,Wegmans
2024-08-22,N/A,N/A,N/A,N/A,Wegmans
2024-08-22,N/A,N/A,N/A,N/A,Wegmans
2024-08-22,N/A,N/A,N/A,N/A,Wegmans
2024-08-22,N/A,N/A,N/A,N/A,Wegmans
2024-08-22,N/A,N/A,N/A,N/A,Wegmans
date,item_name,price,price_per_unit,sale_price,store
2024-08-22,Wegmans Salted Sweet Cream Butter Quarters,3.99 /ea,4 ct ($1.00/ct,N/A,Wegmans
2024-08-22,"Wegmans Grade AA Large Eggs, 18 Count",4.48 /ea,18 ct ($0.25/ct,N/A,Wegmans
2024-08-22,"Wegmans Grade AA Large Eggs, 12 Count",2.99 /ea,24 oz ($0.12/oz,N/A,Wegmans
2024-08-22,"Wegmans Milk, 2% Reduced Fat",2.69 /ea,1 gal ($2.69/gal,N/A,Wegmans
2024-08-22,"Wegmans Organic Large Brown Eggs, 12 Count, Cage Free",4.79 /ea,24 oz ($0.20/oz,N/A,Wegmans
2024-08-22,"Wegmans Milk, Vitamin D, Whole",2.99 /ea,1 gal ($2.99/gal,N/A,Wegmans
2024-08-22,"Wegmans Milk, 1%, Low Fat",2.69 /ea,1 gal ($2.69/gal,N/A,Wegmans
2024-08-22,Wegmans Unsalted Sweet Cream Butter Sticks,3.99 /ea,1 lb ($3.99/lb,N/A,Wegmans
2024-08-22,"Wegmans Milk, Fat Free",2.69 /ea,1 gal ($2.69/gal,N/A,Wegmans
2024-08-22,Wegmans 2% Reduced Fat Milk,2.49 /ea,0.5 gal ($4.98/gal,N/A,Wegmans
2024-08-22,Wegmans Sour Cream,1.89 /ea,16 oz ($0.12/oz,N/A,Wegmans
2024-08-22,Wegmans Half & Half,2.99 /ea,32 fl oz ($0.09/fl oz,N/A,Wegmans
2024-08-22,Wegmans Vitamin D Whole Milk,2.79 /ea,0.5 gal ($5.58/gal,N/A,Wegmans
2024-08-22,Wegmans Mexican Fancy Shredded Cheese,4.49 /ea,16 oz ($0.28/oz,N/A,Wegmans
2024-08-22,Wegmans Sharp Cheddar Shredded Cheese,4.49 /ea,16 oz ($0.28/oz,N/A,Wegmans
2024-08-22,Wegmans Sharp Cheddar Shredded Cheese,2.29 /ea,8 oz ($0.29/oz,N/A,Wegmans
2024-08-22,Wegmans Mexican Fancy Shredded Cheese,2.29 /ea,8 oz ($0.29/oz,N/A,Wegmans
2024-08-22,Wegmans Heavy Cream,3.49 /ea,16 fl oz ($0.22/fl oz,N/A,Wegmans
2024-08-22,"Wegmans Cream Cheese, Bar, Original",1.69 /ea,8 oz ($0.21/oz,N/A,Wegmans
2024-08-22,Wegmans 1% Low Fat Milk,2.49 /ea,0.5 gal ($4.98/gal,N/A,Wegmans
2024-08-22,Wegmans Shredded Whole Milk Mozzarella Cheese,4.49 /ea,16 oz ($0.28/oz,N/A,Wegmans
2024-08-22,Wegmans Fat Free Milk,2.49 /ea,0.5 gal ($4.98/gal,N/A,Wegmans
2024-08-22,Wegmans Low-Moisture Whole Milk Mozzarella Shredded Cheese,2.29 /ea,8 oz ($0.29/oz,N/A,Wegmans
2024-08-22,"Wegmans Sharp Cheddar Cheese, Thin Sliced",2.99 /ea,8 oz ($0.37/oz,N/A,Wegmans
2024-08-22,Wegmans Half & Half,1.99 /ea,16 fl oz ($0.12/fl oz,N/A,Wegmans
2024-08-22,Wegmans Vitamin D Whole Milk,1.89 /ea,1 qt ($1.89/qt,N/A,Wegmans
2024-08-22,Wegmans Heavy Cream,6.29 /ea,32 fl oz ($0.20/fl oz,N/A,Wegmans
2024-08-22,Wegmans Organic Vitamin D Whole Milk,6.99 /ea,1 gal ($6.99/gal,N/A,Wegmans
2024-08-22,"Wegmans Organic Extra Large Brown Eggs, Cage Free",4.99 /ea,27 oz ($0.18/oz,N/A,Wegmans
2024-08-22,Wegmans Sour Cream,1.39 /ea,8 oz ($0.17/oz,N/A,Wegmans
2024-08-22,Wegmans 2% Reduced Fat Milk,1.89 /ea,1 qt ($1.89/qt,N/A,Wegmans
2024-08-22,Wegmans Sharp Cheddar Cheese,2.19 /ea,8 oz ($0.27/oz,N/A,Wegmans
2024-08-22,Wegmans Low-Moisture Part-Skim Mozzarella Shredded Cheese,4.49 /ea,16 oz ($0.28/oz,N/A,Wegmans
2024-08-22,Wegmans Greek Plain Nonfat Yogurt,4.29 /ea,32 oz ($0.13/oz,N/A,Wegmans
2024-08-22,Wegmans Low-Moisture Part-Skim Shredded Mozzarella Cheese,2.29 /ea,8 oz ($0.29/oz,N/A,Wegmans
2024-08-22,"Wegmans Cheese, Non Smoked Provolone, Thin Sliced",2.99 /ea,8 oz ($0.37/oz,N/A,Wegmans
2024-08-22,"Wegmans Cracker Cuts, Extra Sharp Cheddar Cheese",3.69 /ea,10 oz ($0.37/oz,N/A,Wegmans
2024-08-22,"Wegmans Cheese, Colby Jack",2.19 /ea,8 oz ($0.27/oz,N/A,Wegmans
2024-08-22,"Wegmans Sliced Pepperoni, Italian Style",2.99 /ea,6 oz ($0.50/oz,N/A,Wegmans
2024-08-22,"Wegmans Cheese, Cheddar, Extra Sharp, White",2.19 /ea,8 oz ($0.27/oz,N/A,Wegmans
2024-08-22,"Wegmans Swiss Cheese, Thin Sliced",2.99 /ea,8 oz ($0.37/oz,N/A,Wegmans
2024-08-22,Wegmans Half & Half,5.49 /ea,64 fl oz ($0.09/fl oz,N/A,Wegmans
2024-08-22,Wegmans Shredded Taco Cheese,2.29 /ea,8 oz ($0.29/oz,N/A,Wegmans
2024-08-22,"Wegmans Organic Pasture Raised Grade A Large Brown Eggs, 12 Count",6.79 /ea,24 oz ($0.28/oz,N/A,Wegmans
2024-08-22,"Wegmans Grade AA Extra Large Eggs, 18 Count",4.78 /ea,18 ct ($0.27/ct,N/A,Wegmans
2024-08-22,Wegmans Organic 2% Reduced Fat Milk,6.99 /ea,1 gal ($6.99/gal,N/A,Wegmans
2024-08-22,Wegmans Organic Extra Firm Tofu,1.99 /ea,14 oz ($0.14/oz,N/A,Wegmans
2024-08-22,Wegmans Greek Plain Nonfat Yogurt,0.79 /ea,5.3 oz ($0.15/oz,N/A,Wegmans
2024-08-22,"Wegmans Cheese, Cheddar, Extra Sharp, Yellow",2.19 /ea,8 oz ($0.27/oz,N/A,Wegmans
2024-08-22,Wegmans Original Unsweetened Almondmilk,2.29 /ea,64 fl oz ($0.04/fl oz,N/A,Wegmans
2024-08-22,"Wegmans Cheese, Pepper Jack",2.19 /ea,8 oz ($0.27/oz,N/A,Wegmans
2024-08-22,Wegmans Light Sour Cream,1.89 /ea,16 oz ($0.12/oz,N/A,Wegmans
2024-08-22,Wegmans Parmesan Grated Cheese,3.29 /ea,8 oz ($0.41/oz,N/A,Wegmans
2024-08-22,Wegmans Classic Original Hummus,2.49 /ea,8 oz ($0.31/oz,N/A,Wegmans
2024-08-22,Wegmans Vanilla Unsweetened Almondmilk,2.29 /ea,64 fl oz ($0.04/fl oz,N/A,Wegmans
2024-08-22,"Wegmans Greek Vanilla Nonfat Yogurt, FAMILY PACK",4.29 /ea,32 oz ($0.13/oz,N/A,Wegmans
2024-08-22,Wegmans Organic Vitamin D Whole Milk,3.99 /ea,0.5 gal ($7.98/gal,N/A,Wegmans
2024-08-22,Wegmans Heavy Cream,2.69 /ea,8 fl oz ($0.34/fl oz,N/A,Wegmans
2024-08-22,Wegmans Original Oatmilk,N/A,64 fl oz ($0.05/fl oz,N/A,Wegmans
2024-08-22,Wegmans Organic Half & Half,4.99 /ea,1 qt ($4.99/qt,N/A,Wegmans
date,item_name,price,price_per_unit,sale_price,store
2024-08-22,Wegmans Frozen Whole Kernel Corn,1.19 /ea,16 oz ($0.07/oz,N/A,Wegmans
2024-08-22,Wegmans Frozen Sweet Peas,1.49 /ea,16 oz ($0.09/oz,N/A,Wegmans
2024-08-22,"Wegmans Vanilla Ice Cream Sandwiches, 12 Count",N/A,42 fl oz ($0.06/fl oz,N/A,Wegmans
2024-08-22,Wegmans Vanilla Ice Cream,N/A,48 fl oz ($0.05/fl oz,N/A,Wegmans
2024-08-22,Wegmans Tater Puffs,2.99 /ea,32 oz ($0.09/oz,N/A,Wegmans
2024-08-22,Wegmans Frozen Mixed Vegetables,1.19 /ea,16 oz ($0.07/oz,N/A,Wegmans
2024-08-22,"Wegmans Frozen Mixed Berries, FAMILY PACK",N/A,48 oz ($0.17/oz,N/A,Wegmans
2024-08-22,Wegmans Frozen Broccoli Stems & Florets,1.49 /ea,16 oz bag ($0.09/oz bag,N/A,Wegmans
2024-08-22,Wegmans Frozen Cut Green Beans,1.19 /ea,16 oz bag ($0.07/oz bag,N/A,Wegmans
2024-08-22,Wegmans Microwaveable Super-Sweet Corn,0.99 /ea,12 oz ($0.08/oz,N/A,Wegmans
2024-08-22,Wegmans Frozen Cut Leaf Spinach,1.99 /ea,16 oz ($0.12/oz,N/A,Wegmans
2024-08-22,Wegmans Organic Frozen Steamable Broccoli Florets,2.99 /ea,12 oz ($0.25/oz,N/A,Wegmans
2024-08-22,Wegmans Microwaveable Sweet Peas,1.19 /ea,12 oz ($0.10/oz,N/A,Wegmans
2024-08-22,"Wegmans Frozen Fully Cooked Breaded Chicken Breast Strips, FAMILY PACK",14.99 /ea,46 oz ($0.33/oz,N/A,Wegmans
2024-08-22,Wegmans Cookies & Cream Ice Cream,N/A,48 fl oz ($0.05/fl oz,N/A,Wegmans
2024-08-22,Wegmans Frozen Extra Fine Green Beans,1.49 /ea,1 lb bag ($1.49/lb bag,N/A,Wegmans
2024-08-22,Wegmans Microwaveable Mixed Vegetables,0.99 /ea,12 oz ($0.08/oz,N/A,Wegmans
2024-08-22,Wegmans Frozen Peas and Carrots,1.19 /ea,16 oz ($0.07/oz,N/A,Wegmans
2024-08-22,Wegmans Microwaveable Chopped Spinach,1.49 /ea,12 oz ($0.12/oz,N/A,Wegmans
2024-08-22,"Wegmans Frozen Blueberries, FAMILY PACK",7.29 /ea,48 oz ($0.15/oz,N/A,Wegmans
2024-08-22,"Wegmans Frozen Whole Strawberries, FAMILY PACK",6.99 /ea,48 oz ($0.15/oz,N/A,Wegmans
2024-08-22,Wegmans Cookie Dough Ice Cream,N/A,48 fl oz ($0.05/fl oz,N/A,Wegmans
2024-08-22,Wegmans Crispy Fries,2.49 /ea,20 oz ($0.12/oz,N/A,Wegmans
2024-08-22,Wegmans Shoe String Potatoes,2.49 /ea,28 oz ($0.09/oz,N/A,Wegmans
2024-08-22,Wegmans French Vanilla Ice Cream,3.49 /ea,48 fl oz ($0.07/fl oz,N/A,Wegmans
2024-08-22,Wegmans Frozen Petite Sweet Peas,1.99 /ea,16 oz ($0.12/oz,N/A,Wegmans
2024-08-22,Wegmans Microwavable Frozen Broccoli Stems & Florets,1.19 /ea,12 oz bag ($0.10/oz bag,N/A,Wegmans
2024-08-22,Wegmans Mint Chip Ice Cream,N/A,48 fl oz ($0.05/fl oz,N/A,Wegmans
2024-08-22,Wegmans Chocolate Ice Cream,N/A,48 fl oz ($0.05/fl oz,N/A,Wegmans
2024-08-22,Wegmans Frozen Blueberries,2.49 /ea,16 oz ($0.16/oz,N/A,Wegmans
2024-08-22,"Wegmans Frozen Mixed Fruit, FAMILY PACK",9.99 /ea,64 oz ($0.16/oz,N/A,Wegmans
2024-08-22,Wegmans Hash Brown Patties,2.99 /ea,22.5 oz ($0.13/oz,N/A,Wegmans
2024-08-22,"Wegmans Organic Frozen Blueberries, FAMILY PACK",5.99 /ea,32 oz ($0.19/oz,N/A,Wegmans
2024-08-22,Wegmans Frozen Thin Crust Uncured Pepperoni Pizza,3.99 /ea,13.45 oz ($0.30/oz,N/A,Wegmans
2024-08-22,"Wegmans Frozen Garlic Bread Sticks, 6 Count",2.69 /ea,10.5 oz ($0.26/oz,N/A,Wegmans
2024-08-22,Wegmans Frozen Crinkle Cut Carrots,1.19 /ea,16 oz ($0.07/oz,N/A,Wegmans
2024-08-22,"Wegmans Frozen Buttermilk Pancakes, 12 Count",2.49 /ea,16.5 oz ($0.15/oz,N/A,Wegmans
2024-08-22,Wegmans Microwaveable Cut Green Beans,0.99 /ea,12 oz ($0.08/oz,N/A,Wegmans
2024-08-22,Wegmans Broccoli Florets,1.99 /ea,16 oz ($0.12/oz,N/A,Wegmans
2024-08-22,"Wegmans Organic Mango Chunks, FAMILY PACK",7.49 /ea,32 oz ($0.23/oz,N/A,Wegmans
2024-08-22,Wegmans Frozen Thin Crust Cheese Pizza,3.99 /ea,13.3 oz ($0.30/oz,N/A,Wegmans
2024-08-22,Wegmans Oven-Baked Meatballs,3.99 /ea,12 oz ($0.33/oz,N/A,Wegmans
2024-08-22,"Wegmans Oven-Baked Meatballs, FAMILY PACK",14.99 /ea,64 oz ($0.23/oz,N/A,Wegmans
2024-08-22,Wegmans Bake & Rise Uncured Pepperoni Frozen Pizza,3.99 /ea,29.6 oz ($0.13/oz,N/A,Wegmans
2024-08-22,Wegmans Frozen Fully Cooked Breaded Chicken Breast Strips,7.79 /ea,22 oz ($0.35/oz,N/A,Wegmans
2024-08-22,"Wegmans Frozen Garlic Toast, 8 Slices",2.99 /ea,11.25 oz ($0.27/oz,N/A,Wegmans
2024-08-22,Wegmans Frozen French Style Green Beans,1.19 /ea,16 oz bag ($0.07/oz bag,N/A,Wegmans
2024-08-22,Wegmans Low Fat Fudge Bars,N/A,12 x 2.5 fl oz ($0.21/ea,N/A,Wegmans
2024-08-22,"Wegmans Italian Classics Margherita Pizza, Wood-Fired Crust",5.99 /ea,14.6 oz ($0.41/oz,N/A,Wegmans
2024-08-22,Wegmans Sea Salt Caramel Peanut Butter Ice Cream,3.49 /ea,48 fl oz ($0.07/fl oz,N/A,Wegmans
2024-08-22,Wegmans Whipped Topping,1.49 /ea,8 oz ($0.19/oz,N/A,Wegmans
2024-08-22,"Wegmans Ice Cream Bars, Vanilla",N/A,36 fl oz ($0.07/fl oz,N/A,Wegmans
2024-08-22,Wegmans Frozen Raspberries,4.29 /ea,12 oz bag ($0.36/oz bag,N/A,Wegmans
2024-08-22,Wegmans Strawberry Sundae Crunch Ice Cream Bars,N/A,21 fl oz ($0.12/fl oz,N/A,Wegmans
2024-08-22,N/A,N/A,N/A,N/A,Wegmans
2024-08-22,N/A,N/A,N/A,N/A,Wegmans
2024-08-22,N/A,N/A,N/A,N/A,Wegmans
2024-08-22,N/A,N/A,N/A,N/A,Wegmans
2024-08-22,N/A,N/A,N/A,N/A,Wegmans
2024-08-22,N/A,N/A,N/A,N/A,Wegmans
date,item_name,price,price_per_unit,sale_price,store
2024-08-22,Wegmans Ground Beef 80/20 (Avg. 1.01lb),5.54 /ea,$5.49/lb,N/A,Wegmans
2024-08-22,Wegmans Ground Beef 90/10 (Avg. 1.03lb),6.48 /ea,$6.29/lb,N/A,Wegmans
2024-08-22,"Wegmans Boneless Skinless Chicken Breast, Raised without Antibiotics (Avg. 1.61lb)",9.64 /ea,$5.99/lb,N/A,Wegmans
2024-08-22,Wegmans Organic Boneless Skinless Chicken Breasts (Avg. 1.49lb),12.65 /ea,$8.49/lb,N/A,Wegmans
2024-08-22,"Wegmans Ground Beef 80/20, FAMILY PACK (Avg. 5.66lb)",22.58 /ea,$3.99/lb,N/A,Wegmans
2024-08-22,Wegmans Center Cut Uncured Bacon,5.99 /ea,16 oz ($0.37/oz,N/A,Wegmans
