date,item_name,price,price_per_unit,sale_price,store
2024-10-31,"Great Value Hazelnut Spread, 13 oz",2.87,22.1 ¢/oz,N/A,Walmart
2024-10-31,"Great Value Frozen Edamame, 12 oz",1.92,16.0 ¢/oz,N/A,Walmart
2024-10-31,N/A,N/A,N/A,N/A,Walmart
2024-10-31,N/A,N/A,N/A,N/A,Walmart
2024-10-31,N/A,N/A,N/A,N/A,Walmart
2024-10-31,N/A,N/A,N/A,N/A,Walmart
2024-10-31,"Great Value Crispy Rice Treats, 40 Count",9.48,30.4 ¢/oz,N/A,Walmart
2024-10-31,"Great Value French Vanilla Almond Granola, 11 oz",2.67,24.3 ¢/oz,N/A,Walmart
2024-10-31,"Great Value Sardines in Water, 3.75 oz",0.98,25.8 ¢/oz,N/A,Walmart
2024-10-31,"Great Value Flaky Jumbo Buttermilk Biscuits, 8 Count",1.87,11.7 ¢/oz,N/A,Walmart
2024-10-31,"Great Value Pinto Beans, No Salt Added, 15.5 oz",0.86,5.5 ¢/oz,N/A,Walmart
2024-10-31,"Great Value Extra Butter Flavored Microwave Popcorn, 2.55 oz, 12 Count",4.82,$4.82,4.36,Walmart
2024-10-31,"Great Value Original Strawberry Banana Lowfat Yogurt, 6 oz Cups, 4 Count",2.16,9.0 ¢/oz,N/A,Walmart
2024-10-31,"Great Value Neapolitan Ice Cream, 48 fl oz",2.87,6.0 ¢/fl oz,N/A,Walmart
2024-10-31,"Great Value Deli Style Sliced Medium Cheddar Cheese, 8 oz, 12 Count",2.24,28.0 ¢/oz,N/A,Walmart
2024-10-31,"Great Value Fudge Tracks Ice Cream, 48 fl oz",2.87,6.0 ¢/fl oz,N/A,Walmart
2024-10-31,"Great Value Original Strawberry and Peach Lowfat Yogurt, 6 oz Cups, 12 Count",5.87,8.2 ¢/oz,N/A,Walmart
2024-10-31,"Great Value Canola Oil, 1 gal",9.98,7.8 ¢/fl oz,N/A,Walmart
2024-10-31,"Great Value All-Purpose Unbleached Flour, 5LB Bag",2.43,3.0 ¢/oz,N/A,Walmart
2024-10-31,"Great Value Pineapple 100% Juice, 64 fl oz",3.97,6.2 ¢/fl oz,N/A,Walmart
2024-10-31,"Great Value Electrolyte Vitamin Enhanced Strawberry Kiwi Drink Mix, 0.08 oz, 10 Count",2.42,$2.42,1.98,Walmart
2024-10-31,"Great Value Sugar-Free Raspberry Lemonade Powdered Drink Mix, 0.07 oz, 10 Packets",2.24,$2.24,1.98,Walmart
2024-10-31,"Great Value Cinnamon French Toast Bites, 16 oz (Frozen)",3.16,19.8 ¢/oz,N/A,Walmart
2024-10-31,"Great Value Sugar-Free Grape Powdered Drink Mix, 0.77 oz, 10 Packets",2.24,$2.24,1.98,Walmart
2024-10-31,"Great Value Pickled Sliced Beets, Gluten-Free, 15 oz",1.16,7.7 ¢/oz,N/A,Walmart
2024-10-31,"Great Value Pinto Beans, 32 oz",1.98,6.2 ¢/oz,N/A,Walmart
2024-10-31,"Great Value Honey Nut O's Oat Breakfast Cereal, 21.6 oz",2.97,13.8 ¢/oz,N/A,Walmart
2024-10-31,"Great Value Sweet & Salty Chewy Cashew Granola Bars, 7.4 oz, 6 Count",2.18,29.5 ¢/oz,N/A,Walmart
2024-10-31,"Great Value Alkaline AAA Batteries, 8 Count",3.68,46.0 ¢/ea,N/A,Walmart
2024-10-31,"Great Value Caramel Syrup, 24 oz",2.54,10.6 ¢/oz,N/A,Walmart
2024-10-31,"Great Value Coffee Creamer, Pumpkin Pie, 32 fl oz",2.78,8.7 ¢/fl oz,N/A,Walmart
2024-10-31,"Great Value Turkey Gravy Mix, 0.87 oz",0.67,74.4 ¢/oz,N/A,Walmart
2024-10-31,"Great Value Gummy Worms Chewy Candy, 8 oz",1.48,18.5 ¢/oz,N/A,Walmart
2024-10-31,"Great Value Apple Cider Vinegar, 32 fl oz",2.32,7.3 ¢/fl oz,N/A,Walmart
2024-10-31,"Great Value Shredded Extra Sharp Cheddar Cheese, 8 oz",2.24,28.0 ¢/oz,N/A,Walmart
2024-10-31,"Great Value Wavy Lightly Salted Original Potato Chips, 13 oz",2.86,22.0 ¢/oz,N/A,Walmart
2024-10-31,"Great Value 1% Milkfat Small Curd Lowfat Cottage Cheese, 16 oz",2.24,14.0 ¢/oz,N/A,Walmart
2024-10-31,"Great Value Rocky Road Ice Cream, 48 oz",2.87,6.0 ¢/fl oz,N/A,Walmart
2024-10-31,"Great Value Garlic Knots, 8 oz, 6 Count (Frozen)",2.78,34.8 ¢/oz,N/A,Walmart
2024-10-31,"Great Value Dried Cranberries & Candied Pecans, 3.5 oz",2.12,60.6 ¢/oz,N/A,Walmart
2024-10-31,"Great Value Canned Hot Diced Jalapeno Peppers, 4 oz",0.84,21.0 ¢/oz,N/A,Walmart
2024-10-31,"Great Value Cherry Pie Filling or Topping, 21 oz",3.12,14.9 ¢/oz,N/A,Walmart
2024-10-31,"Great Value Tropical Punch, 59 oz",1.82,3.1 ¢/fl oz,N/A,Walmart
2024-10-31,"Great Value Thin Spaghetti Pasta, 32 oz",1.92,6.0 ¢/oz,N/A,Walmart
2024-10-31,"Great Value Light Greek Toasted Coconut Vanilla Nonfat Yogurt, 5.3 oz (Plastic Cup)",0.72,13.6 ¢/oz,N/A,Walmart
2024-10-31,"Great Value Hamburger Dill Chip Pickles, 16 fl oz",1.48,$1.98,N/A,Walmart
2024-10-31,N/A,N/A,N/A,N/A,Walmart
2024-10-31,"Great Value Cream Soda Pop, 12 fl oz, 12 Pack Cans",4.46,3.1 ¢/fl oz,N/A,Walmart
2024-10-31,N/A,N/A,N/A,N/A,Walmart
2024-10-31,N/A,N/A,N/A,N/A,Walmart
2024-10-31,N/A,N/A,N/A,N/A,Walmart
2024-10-31,N/A,N/A,N/A,N/A,Walmart
2024-10-31,"Great Value Crispy Rice Treats, 40 Count",9.48,30.4 ¢/oz,N/A,Walmart
2024-10-31,"Great Value Fully Cooked Homestyle Ground Chicken Fries, 27.5 oz Bag (Frozen)",6.98,$4.06/lb,N/A,Walmart
2024-10-31,"Great Value Unsweet Brewed Iced Tea, 128 fl oz Bottle",2.98,2.3 ¢/fl oz,N/A,Walmart
2024-10-31,"Great Value Diet Tonic Water, 33.8 fl oz Bottle",0.97,2.9 ¢/fl oz,N/A,Walmart
2024-10-31,"Great Value Sugar-Free Grape Drink Mix, 0.32 Oz., 6 Count",2.28,$1.20/oz,N/A,Walmart
2024-10-31,"Great Value Hydrate Alkaline Water, 23.7 fl oz, 15 Count",7.67,2.2 ¢/fl oz,N/A,Walmart
2024-10-31,"Great Value Vegetable Beef Condensed Soup, 10.5 oz Can",0.92,8.8 ¢/oz,N/A,Walmart
2024-10-31,"Great Value Coconut Milk, 13.5 fl oz Can",1.56,11.6 ¢/fl oz,N/A,Walmart
2024-10-31,"Great Value Sugar-Free Strawberry Watermelon Powdered Drink Mix, 0.42 oz, 6 Packets",2.28,91.2 ¢/oz,N/A,Walmart
2024-10-31,"Great Value 100% Pure Beef Burgers, 75% Lean/25% Fat, 3 lbs, 12 Count (Frozen)",11.97,$3.99/lb,N/A,Walmart
2024-10-31,"Great Value Original Sugar Free Whipped Topping, 6.5 oz",2.20,33.8 ¢/oz,N/A,Walmart
2024-10-31,"Great Value Zesty Italian Dressing & Marinade, 16 fl oz",1.97,12.3 ¢/fl oz,N/A,Walmart
2024-10-31,"Great Value Shredded Pizza Blend Cheese, 8 oz Bag",2.24,28.0 ¢/oz,N/A,Walmart
2024-10-31,"Great Value Extra Sharp Cheddar Cheese, 16 oz",3.74,23.4 ¢/oz,N/A,Walmart
2024-10-31,"Great Value Crunchy Raisin Bran Breakfast Cereal, 18.2 oz",2.76,15.2 ¢/oz,N/A,Walmart
2024-10-31,"Great Value Tomato 100% Juice, 64 fl oz",3.28,5.1 ¢/fl oz,N/A,Walmart
2024-10-31,"Great Value Alkaline AA Batteries, 8 Count",3.68,46.0 ¢/ea,N/A,Walmart
2024-10-31,"Great Value Fruit & Grain Cereal Bars Apple Cinnamon, 10.4 oz, 8 Count",2.27,21.8 ¢/oz,N/A,Walmart
2024-10-31,"Great Value Hazelnut Spread, 26.5 oz",4.97,18.8 ¢/oz,N/A,Walmart
2024-10-31,"Great Value Frozen Cooked Small Peeled & Deveined, Tail-off Shrimp, 12 oz Bag (71-90 Count per lb)",5.72,47.7 ¢/oz,N/A,Walmart
2024-10-31,"Great Value Pure Vanilla Extract, 2 fl oz (Food Form: Liquid, Plastic Container)",5.72,$2.86/fl oz,N/A,Walmart
2024-10-31,"Great Value Crispy Battered Fish Fillets, 19 oz, 10 Count (Frozen)",5.44,28.6 ¢/oz,N/A,Walmart
2024-10-31,"Great Value Bay Leaves, 0.12 oz",2.98,$24.83/oz,N/A,Walmart
2024-10-31,"Great Value Pure Vanilla Extract, 1 fl oz (Ambient, Plastic Container, Liquid)",3.94,$3.94/fl oz,N/A,Walmart
2024-10-31,"Great Value Cage Free 100% Liquid Egg Whites, 32 oz",5.24,16.4 ¢/oz,N/A,Walmart
2024-10-31,"Great Value Almond Crunchy Honey Oats Cereal, 18 oz",2.67,14.8 ¢/oz,N/A,Walmart
2024-10-31,"Great Value Regular Buttermilk Biscuits, 10 Count, 4 Pack",2.97,39.6 ¢/oz,N/A,Walmart
2024-10-31,"Great Value Vanilla Sandwich Creme Cookies Family Size, 25 oz",2.58,10.3 ¢/oz,N/A,Walmart
2024-10-31,"Great Value Chewy Chocolate Chip Cookies, 19.5 oz",3.38,17.3 ¢/oz,N/A,Walmart
2024-10-31,"Great Value Colby & Monterey Jack Snack Cheese, 9 oz, 12 Sticks (Plastic Packaging)",3.46,38.4 ¢/oz,N/A,Walmart
2024-10-31,"Great Value Frosted Cherry Toaster Pastries, 20.3oz, 12 Count",1.97,9.7 ¢/oz,N/A,Walmart
2024-10-31,"Great Value Assorted Sandwich Crme Cookies, 25 oz",2.58,10.3 ¢/oz,N/A,Walmart
2024-10-31,"Great Value Original Strawberry and Strawberry Banana Lowfat Yogurt, 6 oz, 12 Count",5.87,8.2 ¢/oz,N/A,Walmart
2024-10-31,"Great Value Donut Variety, Frosted Chocolate & Powdered Sugar, 18.75 oz, 10 Count",4.57,24.3 ¢/oz,N/A,Walmart
2024-10-31,"Great Value Breaded Fish Sticks, 24.7 oz, 44 Count (Frozen)",5.44,22.0 ¢/oz,N/A,Walmart
2024-10-31,"Great Value Shredded Queso Quesadilla Cheese, 16 oz",4.22,26.4 ¢/oz,N/A,Walmart
2024-10-31,"Great Value Nacho Cheese Tortilla Chips, 9.75 oz",2.24,22.9 ¢/oz,N/A,Walmart
2024-10-31,N/A,N/A,N/A,N/A,Walmart
2024-10-31,"Great Value Candy Eyeballs, 0.88 oz",3.88,$4.41/oz,N/A,Walmart
2024-10-31,N/A,N/A,N/A,N/A,Walmart
2024-10-31,"Great Value Italian-Style Stewed Tomatoes with Basil, Garlic & Oregano, 14.5 oz Can",0.98,6.8 ¢/oz,N/A,Walmart
2024-10-31,N/A,N/A,N/A,N/A,Walmart
2024-10-31,"Great Value Sour Cream & Onion Flavored Potato Chips, 7.75 oz Bag",1.50,$1.98,N/A,Walmart
2024-10-31,N/A,N/A,N/A,N/A,Walmart
2024-10-31,"Great Value Wavy Original Potato Chips, 7.75",1.84,23.6 ¢/oz,N/A,Walmart
2024-10-31,N/A,N/A,N/A,N/A,Walmart
2024-10-31,N/A,N/A,N/A,N/A,Walmart
2024-10-31,N/A,N/A,N/A,N/A,Walmart
2024-10-31,N/A,N/A,N/A,N/A,Walmart
2024-10-31,"Great Value Crispy Rice Treats, 40 Count",9.48,30.4 ¢/oz,N/A,Walmart
2024-10-31,"Great Value Lactose Free Lowfat Milk, Half Gallon",3.38,5.3 ¢/fl oz,N/A,Walmart
2024-10-31,"Great Value Chili No Beans, 15 oz Can",2.16,14.4 ¢/oz,N/A,Walmart
2024-10-31,"Great Value Unsalted Tops Saltine Crackers, 16 oz, 4 Count",1.74,10.9 ¢/oz,N/A,Walmart
2024-10-31,"Great Value Everything Bagel Seasoning, 2.6 oz",2.12,81.5 ¢/oz,N/A,Walmart
2024-10-31,"Great Value Whole Milk Mozzarella Cheese, 16 oz Vacuum Pack",3.74,23.4 ¢/oz,N/A,Walmart
2024-10-31,"Great Value Tomato Condensed Soup Family Size, 26 oz Can",1.64,6.3 ¢/oz,N/A,Walmart
2024-10-31,"Great Value Cookie Dipped Ice Cream Cones Variety Pack, 4.6 fl oz, 8 Pack",5.46,14.8 ¢/fl oz,N/A,Walmart
2024-10-31,"Great Value Freeze Dried Strawberry Fruit Crisps, 1 oz",3.72,$3.72/oz,N/A,Walmart
2024-10-31,"Great Value Roasted & Salted Sunflower Kernels, 16 oz YJ",2.48,15.5 ¢/oz,N/A,Walmart
2024-10-31,"Great Value Original Salted Crunchy Potato Chips, 8 oz",1.98,$1.98,1.50,Walmart
2024-10-31,"Great Value Chocolate Fudge Fiber Brownie, Value Pack 10.69 oz, 12 Count",4.00,37.7 ¢/oz,N/A,Walmart
2024-10-31,"Great Value Butter Flavor Jumbo Biscuits, 16 oz, 8 Count",1.87,11.7 ¢/oz,N/A,Walmart
2024-10-31,"Great Value Original Breakfast Sausage, 24.92 oz",8.36,$5.36/lb,N/A,Walmart
2024-10-31,"Great Value White Cranberry Strawberry Juice Cocktail, 64 fl oz",2.98,4.7 ¢/fl oz,N/A,Walmart
2024-10-31,"Great Value Sliced Strawberries, 64 oz (Frozen)",9.22,14.4 ¢/oz,N/A,Walmart
2024-10-31,"Great Value Hazelnut Coffee Creamer, 64 fl oz",4.98,7.8 ¢/fl oz,N/A,Walmart
2024-10-31,"Great Value Sea Salt Caramel Ice Cream, 48 fl oz",2.87,6.0 ¢/fl oz,N/A,Walmart
2024-10-31,"Great Value Pepperoni Pizza Snack Rolls, 65 oz, 130 Count Frozen",9.83,15.1 ¢/oz,N/A,Walmart
2024-10-31,"Great Value Extra Sharp Whole White Cheddar Cheese Block, 8 oz",1.97,24.6 ¢/oz,N/A,Walmart
2024-10-31,"Great Value Squeezable Grape Jelly, 20 oz",2.78,13.9 ¢/oz,N/A,Walmart
2024-10-31,"Great Value Canned Leaf Spinach, 13.5 oz Can",1.32,9.8 ¢/oz,N/A,Walmart
2024-10-31,"Great Value Pineapple Chunks, Frozen, 16 oz",2.47,15.4 ¢/oz,N/A,Walmart
2024-10-31,"Great Value Organic Steamable Riced Cauliflower, 10 oz (Frozen)",1.98,19.8 ¢/oz,N/A,Walmart
2024-10-31,"Great Value 100% White Grape Juice, 64 fl oz",2.98,4.7 ¢/fl oz,N/A,Walmart
2024-10-31,"Great Value Deli Style Sliced Non-Smoked Provolone Cheese, 16 oz, 24 Count",4.22,26.4 ¢/oz,N/A,Walmart
2024-10-31,"Great Value Organic Frozen Blueberries, 10 oz",2.98,29.8 ¢/oz,N/A,Walmart
2024-10-31,"Great Value Stuffed Manzanilla Olives with Minced Pimento, 21 oz Jar",4.42,21.0 ¢/oz,N/A,Walmart
2024-10-31,"Great Value Sugar Snap Pea Stir-Fry, 20 oz (Frozen)",2.54,12.7 ¢/oz,N/A,Walmart
2024-10-31,"Great Value Kettle Cooked Original Potato Chips, 8 oz Bag",1.98,24.8 ¢/oz,N/A,Walmart
2024-10-31,"Great Value Plain Nonfat Yogurt, 32 oz",2.56,8.0 ¢/oz,N/A,Walmart
2024-10-31,"Great Value Rotisserie Chicken Lunchmeat, 16 oz Plastic Tub, 10g of Protein per 2 oz Serving",5.77,$5.77/lb,N/A,Walmart
2024-10-31,"Great Value Reduced Sodium Real Bacon Pieces, 2.5 oz",1.98,79.2 ¢/oz,N/A,Walmart
2024-10-31,"Great Value Reduced Sodium Taco Seasoning Mix, 1 oz",0.54,54.0 ¢/oz,N/A,Walmart
2024-10-31,"Great Value Stuffed Crust Chicken Bacon Ranch Sauce Pizza, 23.1 oz (Frozen)",7.66,33.2 ¢/oz,N/A,Walmart
2024-10-31,"Great Value Spaghetti Pasta, 1 lb, 4 Count",3.76,5.9 ¢/oz,N/A,Walmart
2024-10-31,"Great Value Energy Peach Mango Drink Mix, 0.09 oz, 10 Count",2.16,$2.16,1.98,Walmart
2024-10-31,"Great Value Cracker Cut Sliced 4 Cheese Tray, 16 oz",4.98,31.1 ¢/oz,N/A,Walmart
2024-10-31,"Great Value Pepper Jack Cheese, 16 oz Block (Plastic Packaging)",3.74,23.4 ¢/oz,N/A,Walmart
2024-10-31,"Great Value Jasmine Rice 90 Second Pouch, 8.8 oz",1.42,16.1 ¢/oz,N/A,Walmart
2024-10-31,"Great Value All Natural Boneless Skinless Chicken Breast, 8 lb (Frozen)",23.92,$23.92,21.36,Walmart
2024-10-31,N/A,N/A,N/A,N/A,Walmart
2024-10-31,N/A,N/A,N/A,N/A,Walmart
2024-10-31,N/A,N/A,N/A,N/A,Walmart
2024-10-31,"Great Value Crispy Rice Treats, 40 Count",9.48,30.4 ¢/oz,N/A,Walmart
2024-10-31,"Great Value Ricotta Cheese, 15 oz Tub (Refrigerated)",2.48,16.5 ¢/oz,N/A,Walmart
2024-10-31,"Great Value Roast Beef Lunchmeat, 7oz Plastic Tub, 10 G of Protein per 2 oz (56g) Serving",4.24,$9.64/lb,N/A,Walmart
2024-10-31,"Great Value Salted & Roasted in Shell Peanuts, 20 oz",1.98,9.9 ¢/oz,N/A,Walmart
2024-10-31,"Great Value Gelatin Dessert, Strawberry, 3 oz",0.98,32.7 ¢/oz,N/A,Walmart
2024-10-31,"Great Value No Salt Added Light Red Kidney Beans, 15.5 oz",0.86,5.5 ¢/oz,N/A,Walmart
2024-10-31,"Great Value Rippled Original Potato Chips, 8 oz",1.98,$1.98,1.50,Walmart
2024-10-31,"Great Value Maraschino Cherries, 16 oz",3.68,23.0 ¢/oz,N/A,Walmart
2024-10-31,"Great Value 100% Arabica Colombian Medium Dark Roast Ground Coffee Pods, 12 Ct",4.47,$1.15/oz,N/A,Walmart
2024-10-31,"Great Value Frozen Cooked Extra Small Peeled & Deveined, Tail-off Shrimp, 12 oz (100-150 per lb)",5.46,45.5 ¢/oz,N/A,Walmart
2024-10-31,"Great Value Strawberry Banana Blend, 48 oz (Frozen)",6.86,14.3 ¢/oz,N/A,Walmart
2024-10-31,"Great Value Deli Style Sliced Extra Sharp Cheddar Cheese, 8 oz Resealable Plastic Bag, 12 Slices",2.24,28.0 ¢/oz,N/A,Walmart
2024-10-31,"Great Value Spirals Macaroni & Cheese, 5.5 oz",0.58,10.5 ¢/oz,N/A,Walmart
2024-10-31,"Great Value Frozen Sliced Peaches, 16 oz",2.86,17.9 ¢/oz,N/A,Walmart
2024-10-31,"Great Value Deli Style Sliced Gouda Cheese, 8 oz, 12 Count",2.24,28.0 ¢/oz,N/A,Walmart
2024-10-31,"Great Value Cinnamon Applesauce, 48 oz Jar",3.12,6.5 ¢/oz,N/A,Walmart
2024-10-31,"Great Value Stuffed Manzanilla Olives with Minced Pimento, 10 oz Jar",2.52,25.2 ¢/oz,N/A,Walmart
2024-10-31,"Great Value Cranberry Juice Cocktail, 64 fl oz",2.98,4.7 ¢/fl oz,N/A,Walmart
2024-10-31,"Great Value Caramel Coconut & Fudge Cookies, 8.5 oz",2.88,33.9 ¢/oz,N/A,Walmart
2024-10-31,"Great Value Peppermint Starlight Mints Hard Candy, 10 oz",1.48,14.8 ¢/oz,N/A,Walmart
2024-10-31,"Great Value Brown Rice, Whole Grain, 16 oz",0.88,5.5 ¢/oz,N/A,Walmart
2024-10-31,"Great Value Lentils, 1 lb",1.92,12.0 ¢/oz,N/A,Walmart
2024-10-31,"Great Value Fully Cooked Original Turkey Breakfast Patties, 24.92 oz (Frozen)",10.74,$6.89/lb,N/A,Walmart
2024-10-31,Great Value Chewy Protein Bar Peanut Butter & Dark Chocolate 10g Protein 5 Ct,2.94,41.4 ¢/oz,N/A,Walmart
2024-10-31,"Great Value Artisan Crafted Macaroni and Cheese, Italian Five Cheese, 12 oz (Shelf Stable)",2.38,19.8 ¢/oz,N/A,Walmart
2024-10-31,"Great Value Shredded Whole Milk Low-Moisture Mozzarella Cheese, 8 oz",2.24,28.0 ¢/oz,N/A,Walmart
2024-10-31,"Great Value Fudge Mint Cookies, 10 oz",2.12,21.2 ¢/oz,N/A,Walmart
2024-10-31,"(3 pack) Great Value Apple Cider Vinegar, 32 fl oz",6.96,7.3 ¢/fl oz,N/A,Walmart
2024-10-31,"Great Value Fully Cooked Italian Style Meatballs, Family Size, Frozen, 48 oz",9.96,20.8 ¢/oz,N/A,Walmart
2024-10-31,"Great Value Pitted Dark Sweet Cherries, 16 oz (Frozen)",3.66,22.9 ¢/oz,N/A,Walmart
2024-10-31,"Great Value Pancakes & Sausage on a Stick, 30 oz, 12 Count (Frozen). Contains Wheat, Milk, Eggs and Soy",7.46,$3.97/lb,N/A,Walmart
2024-10-31,"Great Value Brown Sugar & Cinnamon Cream Cheese, 8 oz Tub (Refrigerated)",2.27,28.4 ¢/oz,N/A,Walmart
2024-10-31,"Great Value Deluxe Moist Devil's Food Chocolate Cake Mix, 15.25 oz",1.00,6.6 ¢/oz,N/A,Walmart
2024-10-31,"Great Value Toasted O's Breakfast Cereal, 12 oz",1.67,13.9 ¢/oz,N/A,Walmart
2024-10-31,"Great Value Strawberry Watermelon Liquid Drink Enhancer, 3.11 fl oz Bottle",3.96,$1.28/fl oz,N/A,Walmart
2024-10-31,"Great Value Sun-Dried Raisins Canister, 20 oz (1lb 4oz) 567g",4.28,21.4 ¢/oz,N/A,Walmart
2024-10-31,"Great Value Iced Tea Bags Family Size, 24 Count, 6 oz",1.94,$8.08/100 ct,N/A,Walmart
2024-10-31,"Great Value Yellow Mustard, 8 oz",0.64,8.0 ¢/oz,N/A,Walmart
2024-10-31,"Great Value Alaskan Pink Salmon, 14.75 oz",3.00,20.3 ¢/oz,N/A,Walmart
2024-10-31,"Great Value Cherry Berry Blend, Frozen, 48 oz in Resealable Bag",7.47,15.6 ¢/oz,N/A,Walmart
2024-10-31,N/A,N/A,N/A,N/A,Walmart
2024-10-31,N/A,N/A,N/A,N/A,Walmart
2024-10-31,N/A,N/A,N/A,N/A,Walmart
2024-10-31,"Great Value Crispy Rice Treats, 40 Count",9.48,30.4 ¢/oz,N/A,Walmart
2024-10-31,"Great Value Tartar Sauce, 12 fl oz",1.48,12.3 ¢/fl oz,N/A,Walmart
2024-10-31,"Great Value Freeze Dried Fruit Crisps, Variety Pack, 6 Count, 2.26 oz.",5.48,$2.38/oz,N/A,Walmart
2024-10-31,"Great Value Original Sour Cream, 48 oz",4.92,10.3 ¢/oz,N/A,Walmart
2024-10-31,"Great Value Fruit Punch Drink Mix, 0.78 Oz, 10 Count",2.24,$2.24,1.98,Walmart
2024-10-31,"Great Value Dark Chocolate Bar, 3.52 oz",1.12,32.0 ¢/oz,N/A,Walmart
2024-10-31,"Great Value Light Mozzarella String Cheese, 10 oz Bag, 12 Count",3.34,33.4 ¢/oz,N/A,Walmart
2024-10-31,"Great Value Light Greek Peach Nonfat Yogurt, 5.3 oz, 4 Plastic Cups",2.58,12.2 ¢/oz,N/A,Walmart
2024-10-31,"Great Value Classic Medium Roast Ground Naturally Caffeinated Coffee, 40.3 oz Cannister",12.46,30.9 ¢/oz,N/A,Walmart
2024-10-31,"Great Value Natural Brown Long Grain Rice, 32 oz",1.64,5.1 ¢/oz,N/A,Walmart
2024-10-31,"Great Value Peanut Butter Cup Ice Cream, 48 fl oz",2.87,6.0 ¢/fl oz,N/A,Walmart
2024-10-31,"Great Value Country Sausage Gravy, Canned, 15.0 oz",1.17,7.8 ¢/oz,N/A,Walmart
2024-10-31,"Great Value Neufchtel Cheese, 8 oz Box",1.97,24.6 ¢/oz,N/A,Walmart
2024-10-31,"Great Value Taco Shells, 4.6 oz, 12 Count",1.54,33.5 ¢/oz,N/A,Walmart
2024-10-31,"Great Value Black Pepper & Iodized Salt, 5.25 oz",1.76,N/A,N/A,Walmart
2024-10-31,"Great Value Fruit & Grain Cereal Bars, Blueberry, 1.3 oz, 8 Count",2.27,21.8 ¢/oz,N/A,Walmart
2024-10-31,"Great Value Brown Sugar Hickory Baked Beans, 28 oz Can",1.94,6.9 ¢/oz,N/A,Walmart
2024-10-31,"Great Value Original Luncheon Meat, High Protein, 12 oz Aluminum Can",2.00,$2.67/lb,N/A,Walmart
2024-10-31,"Great Value Neapolitan Ice Cream, 128 fl oz",7.12,5.6 ¢/fl oz,N/A,Walmart
2024-10-31,"Great Value Fat Free Rainbow Sherbet, 48 fl oz",2.87,6.0 ¢/fl oz,N/A,Walmart
2024-10-31,"Great Value Turkey Flavored Stuffing Mix, 6 oz",0.97,16.2 ¢/oz,N/A,Walmart
2024-10-31,"Great Value Quartered Artichoke Hearts, 13.75 oz",2.22,16.1 ¢/oz,N/A,Walmart
2024-10-31,"Great Value Finely Shredded Italian Style Cheese, 16 oz",4.22,26.4 ¢/oz,N/A,Walmart
2024-10-31,"Great Value Sugar-Free Pink Lemonade Drink Mix, 0.14 oz, 10 Count",2.24,$2.24,1.98,Walmart
2024-10-31,"Great Value Garlic Pepper Crispy Onions Salad Topping, 3.5 oz Resealable Bag",1.54,44.0 ¢/oz,N/A,Walmart
2024-10-31,"Great Value Deluxe Mixed Nuts, 30 oz",13.98,46.6 ¢/oz,N/A,Walmart
2024-10-31,"Great Value Dry Roasted and Unsalted Peanuts, 16 oz, Jar",2.48,15.5 ¢/oz,N/A,Walmart
2024-10-31,"Great Value Sliced Carrots, 8.25 oz Can",0.67,8.1 ¢/oz,N/A,Walmart
2024-10-31,"Great Value Twist & Shout Chocolate Sandwich Cookies, 19.1 oz",3.28,17.2 ¢/oz,N/A,Walmart
2024-10-31,"Great Value Cracker Cuts Sliced Sharp Cheddar Cheese, 10 oz, 30 Count",2.97,29.7 ¢/oz,N/A,Walmart
2024-10-31,"Great Value French Vanilla Non-Dairy Coffee Creamer, Sugar-Free, 10.2 oz",3.48,34.1 ¢/oz,N/A,Walmart
2024-10-31,"Great Value Organic Unrefined Virgin Coconut Oil, 14 fl oz",5.98,42.7 ¢/fl oz,N/A,Walmart
2024-10-31,"Great Value No Stir Creamy Natural Peanut Butter Spread, 40 oz",3.98,10.0 ¢/oz,N/A,Walmart
2024-10-31,"Great Value Artisan Crafted Macaroni and Cheese, Smoked Gouda, 12 oz Shelf Stable",2.38,19.8 ¢/oz,N/A,Walmart
2024-10-31,"Great Value Baking Soda, 64 Oz",3.24,5.1 ¢/oz,N/A,Walmart
2024-10-31,GREAT VALUE JUMBO SHELL 12 OZ,1.84,15.3 ¢/oz,N/A,Walmart
2024-10-31,"Great Value Deli Style Sliced Provolone Cheese, 8 oz, 19 Slices (Plastic Packaging)",2.24,28.0 ¢/oz,N/A,Walmart
2024-10-31,"Great Value Unsweetened Applesauce, 3.2 oz, 12 Pouches",6.44,16.8 ¢/oz,N/A,Walmart
2024-10-31,"Great Value Original Blueberry Lowfat Yogurt, 6 oz Cups, 4 Count",1.96,8.2 ¢/oz,N/A,Walmart
2024-10-31,N/A,N/A,N/A,N/A,Walmart
2024-10-31,"Great Value Stadium Style Cheddar Cheese Dip, 15 oz",2.47,16.5 ¢/oz,N/A,Walmart
2024-10-31,N/A,N/A,N/A,N/A,Walmart
2024-10-31,N/A,N/A,N/A,N/A,Walmart
2024-10-31,N/A,N/A,N/A,N/A,Walmart
2024-10-31,"Great Value Crispy Rice Treats, 40 Count",9.48,30.4 ¢/oz,N/A,Walmart
2024-10-31,"Great Value Orange Blast Drink Enhancer, 3.11 fl oz Bottle",3.96,$1.28/fl oz,N/A,Walmart
2024-10-31,"Great Value Organic Chia Seeds, 32 oz (907g)  USDA Organic, Gluten-Free, No Nuts/Soy/Dairy",8.88,27.8 ¢/oz,N/A,Walmart
2024-10-31,"Great Value Fat Free and Cholesterol Free Egg Makers, 32oz Carton",4.37,13.7 ¢/oz,N/A,Walmart
2024-10-31,"Great Value Ranch Chunk Light Tuna, 2.6 oz Pouch",0.88,33.8 ¢/oz,N/A,Walmart
2024-10-31,"Great Value Macaroni & Beef, 15 oz",0.98,6.5 ¢/oz,N/A,Walmart
2024-10-31,"Great Value Original Dairy Whipped Topping, 6.5 oz",2.20,33.8 ¢/oz,N/A,Walmart
2024-10-31,"Great Value Sugar-Free Cherry Drink Mix, 0.78 oz, 10 Count",2.24,$2.24,1.98,Walmart
2024-10-31,"Great Value Pure Maple Syrup, 12.5 fl oz",7.98,63.8 ¢/fl oz,N/A,Walmart
2024-10-31,"Great Value Mountain Trail Mix, 26 oz",5.98,23.0 ¢/oz,N/A,Walmart
2024-10-31,"Great Value Garden Rotini Pasta, 16 oz",0.98,6.1 ¢/oz,N/A,Walmart
2024-10-31,"Great Value Energy Drink Mix, Sugar Free Blueberry Acai, 10 Count",2.16,$2.16,1.98,Walmart
2024-10-31,"Great Value All Natural Chicken Wing Sections, 8 lb (Frozen)",23.96,$3.00/lb,N/A,Walmart
2024-10-31,"Great Value Extra Wide Egg Noodles, 16 oz",1.48,9.3 ¢/oz,N/A,Walmart
2024-10-31,"Great Value Original Coffee Creamer, 16 oz",3.48,21.8 ¢/oz,N/A,Walmart
2024-10-31,"Great Value Thousand Island Dressing, 16 fl oz",1.97,12.3 ¢/fl oz,N/A,Walmart
2024-10-31,"Great Value Cooked Ham, 32 oz",8.48,$4.24/lb,N/A,Walmart
2024-10-31,"Great Value Organic Dark Red Kidney Beans, 15 oz",1.16,7.7 ¢/oz,N/A,Walmart
2024-10-31,Great Value Banana Cream Instant Pudding & Pie Filling in a 3.4 oz Carton,0.98,28.8 ¢/oz,N/A,Walmart
2024-10-31,"Great Value Cream Cheese Spread, 12 oz Tub",3.26,27.2 ¢/oz,N/A,Walmart
2024-10-31,"Great Value Yeast Dinner Rolls, 15oz, 10 Count (Frozen)",3.47,23.1 ¢/oz,N/A,Walmart
2024-10-31,"Great Value French Vanilla Non-Dairy Coffee Creamer, 15 oz",3.48,23.2 ¢/oz,N/A,Walmart
2024-10-31,"Great Value Toasted Corn Flakes Breakfast Cereal, 18 oz",2.24,12.4 ¢/oz,N/A,Walmart
2024-10-31,"Great Value Instant White Rice, 42 oz (Shelf Stable)",3.98,9.5 ¢/oz,N/A,Walmart
2024-10-31,"Great Value Regular Jumbo Buttermilk Biscuits, 10 oz, 5 Count",1.28,12.8 ¢/oz,N/A,Walmart
2024-10-31,"Great Value Shredded Medium Cheddar Cheese, 8 oz",2.24,28.0 ¢/oz,N/A,Walmart
2024-10-31,"Great Value Chocolate Chip Chewy Granola Bars, .84 oz, 10 Count",1.78,21.2 ¢/oz,N/A,Walmart
2024-10-31,"Great Value Organic Strained Raw Honey, 16 oz Inverted Plastic Bottle",5.97,37.3 ¢/oz,N/A,Walmart
2024-10-31,"Great Value Multi-Grain Crackers, 12.7 oz",2.98,23.5 ¢/oz,N/A,Walmart
2024-10-31,"Great Value Diet Sweet Brewed Iced Tea, 128 fl oz Bottle",2.98,2.3 ¢/fl oz,N/A,Walmart
2024-10-31,Great Value Instant Mashed Potatoes 13.75 oz Box,2.12,$2.12,1.88,Walmart
2024-10-31,"Great Value Cupcake Liners, White, 96 Ct",1.12,1.2 ¢/count,N/A,Walmart
2024-10-31,"Great Value Apple Juice, 8 fl oz, 6 Count (Shelf Stable)",3.82,8.0 ¢/fl oz,N/A,Walmart
2024-10-31,"Great Value 100% Arabica Caramel Medium Roast Coffee Pods, 12 Ct",4.47,$1.15/oz,N/A,Walmart
2024-10-31,"Great Value Unsweetened Applesauce, 3.2 oz, 24 Pouches",9.44,12.3 ¢/oz,N/A,Walmart
2024-10-31,"Great Value Block Sharp Cheddar Cheese, 32 oz",7.34,22.9 ¢/oz,N/A,Walmart
2024-10-31,"Great Value Whole Milk Low Moisture Mozzarella String Cheese Sticks, 12 Count Bag (Refrigerated)",3.34,27.8 ¢/oz,N/A,Walmart
2024-10-31,"Great Value Premium Sweet & Spicy Chunk Light Tuna, 2.6 oz Pouch",0.88,33.8 ¢/oz,N/A,Walmart
2024-10-31,"Great Value Tonic Water, 33.8 fl oz Bottle",0.97,2.9 ¢/fl oz,N/A,Walmart
2024-10-31,"Great Value Blueberry Snack Mini Muffins, Moist, Light, Fluffy Individually Wrapped Pastry, 12 oz, 12 Count",3.97,33.1 ¢/oz,N/A,Walmart
2024-10-31,"Great Value Freeze Dried Strawberry Fruit Crisps, 0.26 oz, 6 Count",5.88,$3.68/oz,N/A,Walmart
2024-10-31,N/A,N/A,N/A,N/A,Walmart
2024-10-31,N/A,N/A,N/A,N/A,Walmart
date,item_name,price,price_per_unit,sale_price,store
2024-10-31,"Gourmet Garden Gluten Free Minced Garlic Stir-in Paste, 4 oz Tube",3.94,98.5 ¢/oz,N/A,Walmart
2024-10-31,"Fresh Banana, Each",0.26,50.0 ¢/lb,N/A,Walmart
2024-10-31,"Fresh Strawberries, 1 lb Container",2.92,18.3 ¢/oz,N/A,Walmart
2024-10-31,Fresh Sweet Corn on the Cob (1 each),0.75,N/A,N/A,Walmart
2024-10-31,"Fresh Cucumber, Each",0.72,N/A,N/A,Walmart
2024-10-31,"Fresh Hass Avocados, Each",0.88,N/A,N/A,Walmart
2024-10-31,"Fresh Roma Tomato, Each",0.25,98.0 ¢/lb,N/A,Walmart
2024-10-31,"Fresh Green Bell Pepper, Each",0.86,N/A,N/A,Walmart
2024-10-31,"Cantaloupe, each",2.98,N/A,N/A,Walmart
2024-10-31,"Fresh Clementines, 3 lb. Bag",4.98,$1.66/lb,N/A,Walmart
2024-10-31,1lb Baby Peeled Carrots,1.32,8.3 ¢/oz,N/A,Walmart
2024-10-31,"Fresh Iceberg Lettuce, Each",1.98,N/A,N/A,Walmart
2024-10-31,"Marketside Fresh Organic Bananas, Bunch",2.26,74.0 ¢/lb,N/A,Walmart
2024-10-31,"Fresh Green Onions Bunch, Each",0.98,N/A,N/A,Walmart
